sentence_id	n	v	n_first_index	n_last_index	v_first_index	v_last_index	sentence_text
48087483	scene	dreading	13	13	10	10	People were really friendly , but I just sat there dreading my first scene in which I had to sing a song in the pub with all those famous faces watching me .
48177621	scene	dreaded	13	13	10	10	Payne told Tony Purnell from the Daily Mirror that she dreaded her first scene with Audenshaw and was nervous about `` getting up close and personal '' with him .
48624108	birth	dreading	6	6	4	4	Parents have thus started dreading the birth of daughters in the family , going as far as determining the sex of fetuses in order to abort daughters .
48678088	monster	dreaded	28	28	26	26	Pasquale ' s `` dream ship '' sequences get much play , as does his relationship with his beloved guardian angel or the bathtub ' s dreaded drain monster .
48724411	theorising	dreading	6	6	4	4	Patient and exact , dreading hasty theorising , he did much for the history , archaeology , and geology of Devon and Cornwall .
49127060	day	dreading	43	43	41	41	Of the process , which saw characters leave , Muschamp explained `` They had the head-shots of all the different characters lined up above the mirrors and as people left , they ' d turn them upside down , I remember dreading the day my head got turned '' .
49151610	thought	dreaded	8	8	6	6	Officers and Senior NCO ' s dreaded the thought of starting all over with the Basic Stage of Training .
49739694	police	dreaded	10	10	8	8	On December 6 , Felix Dzerzhinsky ' s dreaded secret police , Cheka entered Yerevan , thus effectively ending all existence of the DRA .
50593279	force	dreaded	27	27	24	24	No rest , no breathing time was granted them , except in the quarter where stood that most valiant king , as the foe dreaded the incomparable force of his blows .
52294676	reception	dreading	12	12	10	10	On opening night , Stella refuses to go on , dreading her reception , but Keith shows up backstage and points out at least two in the audience who believe in her , Gloria and Nana .
52426889	regime	dreaded	12	12	16	16	One memorandum declared that since the beginning of the Usta s e regime , that Muslims dreaded the lawless activities that some Usta s e , some Croatian government authorities , and various illegal groups perpetrated against the Serbs .
52975668	moment	dreads	8	8	6	6	Rowena Joy , however , still dreads the moment when she will have to tell Gino the truth .
53194998	influence	dreading	8	8	5	5	Seecombe is also unhappy , dreading a female influence on the household .
53754434	prospect	dreaded	23	23	27	27	Rossetti ' s mother began teaching in order to keep the family out of poverty and Maria became a live-in governess , a prospect that Christina Rossetti dreaded .
54226223	father	dreads	3	3	1	1	She dreads her father to a great extent and fears that things will go topsy-turvy if their relationship blossoms into love .
54226226	nothing	dreads	2	2	1	1	She dreads nothing more than a visit from her plebiean mother , and ghoulish brother Cecil , from the North .
54703788	cake	dreading	10	10	16	16	She notices Laura ' s amateur efforts at making a cake , just what Laura was dreading .
54725230	trial	dreading	15	15	12	12	She joins with the local police to solve the murders , while dreading her awaiting trial .
54841059	prospect	dreaded	6	6	4	4	Shareholders in the WIC dreaded the prospect of a truce in the Americas , which would thwart the plans of that company to stage an invasion of Portuguese Brazil .
54873767	thought	dreads	4	4	2	2	She also dreads the thought of going supermarket-shopping by herself .
55510646	prospect	dreaded	24	24	22	22	The subject was scheduled to undergo segmental resection of his left ankle , which was severely infected with tuberculosis , but he dreaded the prospect of general anesthesia because he had suffered severe adverse side effects during multiple previous operations .
55668659	trip	dreading	14	14	10	10	The story begins with Nicolas at ten years old and dreading the school ski trip .
56408332	thought	dreading	8	8	6	6	Spennymoor players and fans alike were dreading the thought of extra time and penalties , or even worse , losing .
56488307	arrival	dreads	8	8	6	6	Southern California ranch boy Billy Deane dreads the arrival of Penny , a visitor from New York .
56513903	distraught	dreads	18	18	9	9	Spaceshot , most openly vulnerable ; Miles , who dreads the inevitable ; Flash , a redneck cowboy distraught over a secret he ' s shared just once ; X-Factor , doomed to repeat the sins of her mother ; LT56 , a middle-aged survivor of a life-altering tragedy ; and Dwarfstar , the organizer , the prophet .
56543969	arrival	dreading	14	14	18	18	Soon , they discover to their horror that the stranger is that man whose arrival they have been dreading for a long time now , Sivankutty .
56833614	war	dreaded	7	7	5	5	Some historians argue that they dreaded a war with Austria ; others that they wanted war because they thought France would lose and the Austrians and the other invaders would then restore the absolute monarchy .
57023051	prospect	dreading	12	12	10	10	Soon after Hassan ' s defeat , the British , dreading the prospect of another several decades of costly and difficult battles with yet another Somali potentate , set about attempting to neutralize Sultan Shire ' s influence .
57048491	fate	dreading	5	5	2	2	Stair , dreading a similar fate , went to London to seek a personal interview with the king , who had more than once befriended him , perhaps remembering his services in the Netherlands , but the Duke of York intercepted his access to the royal ear , and when he returned to Scotland he found a new commission of judges issued , from which his name was omitted .
58917813	day	dreads	10	10	8	8	The Hunger Games are over , but Katniss dreads the day her children learn about their parents ' involvement in both the Games and the war .
59565416	retaliation	dreaded	38	38	37	37	The manifesto ' s signatories did not want to engage in a military war by supporting the liberation pugilists , because , for one thing , they could ill afford it and , for another , they dreaded retaliation .
60019082	affair	dreaded	18	18	16	16	That is a great deal so say on the part of one who greatly disliked and dreaded the affair from the first ' .
60262328	election	dread	6	6	4	4	Tammany mayor ; I dread the election of a good one .
60351836	idea	dreads	3	3	1	1	Tessa dreads the idea of living in the suburbs .
60854734	contact	dreading	24	24	20	20	Taijin kyofusho is commonly described as a form of social anxiety -LRB- social phobia -RRB- , with the person suffering dreading and avoiding social contact , and as a subtype of shinkeishitsu -LRB- anxiety disorder -RRB- .
60931816	conflict	dreading	7	7	5	5	Suvannaph u m a , dreading further conflict and apparently trusting Suph a nuvong ' s promises of a moderate policy , gave instructions that the Path e t Lao were not to be resisted , and the U .
61169898	possibility	dreads	19	19	17	17	The crew is unsure of how to explain to her that her mother is lost , and dreads the possibility that Sam may have died .
61618068	speaking	dreaded	9	9	7	7	The Duke of York , Prince Albert dreaded public speaking because he suffered from a severe stammer .
63558846	idea	dreaded	27	27	25	25	The Haitian emigration project ran against the wishes of the American Colonization Society , which attempted to remove free Blacks as far as Africa and dreaded the idea of strengthening the Black state of Haiti .
63682495	offensive	dreaded	41	41	39	39	Their target , Sakishima , had been serving as a refueling base for Japanese aircraft shuttling between Ky u sh u and Formosa and was thus an important link in the chain of airbases which supplied Japan ' s dreaded kamikaze offensive with its deadly aircraft .
64095306	vengeance	dreads	15	15	13	13	The gods sit in it and know all things ; and the offender dreads their vengeance .
64299567	loss	dreaded	38	38	36	36	Their lukewarm attitude towards the British was also fostered by their desire to preserve the accomplished fact of ethnic frontiers of the Albanian State restored by the Italians in 1941 , for they bitterly opposed and dreaded the loss of Kosovo and Debar to Yugoslavia once again , and feared that the Allies in their support of the Greeks might prevent them from claiming Chameria and deprive them of their southern provinces of Kor c e and Gjirokaster , the heartland of their liberation movement .
64469396	job	dreading	4	4	2	2	Though initially dreading the job , Khemri then finds that the ' supply station ' is in fact just a cover for the Adjustment service , the secret service of the Empire .
64629574	day	dreading	17	17	15	15	Though feeling safer now that he has Don Corleone on his side , Bonasera begins dreading the day Corleone asks him a favor ; he has a nightmare of the Don ordering him to bury the bodies of two men he has just killed .
65021830	vengeance	dreads	3	3	1	1	Tope dreads the vengeance of Saul Stark should he betray the conjure-man .
65176505	leader	dreaded	22	22	21	21	Three thousand years ago , the Island of Gorm faced its gravest hour - Magor , the Volcano tribe ' s dreaded leader , was at the zenith of his power .
65554774	daylight	dread	2	2	1	1	They dread daylight , which is fatal to them .
65554775	influence	dreaded	3	3	1	1	They dreaded his influence and courted his favor .
65554776	consequence	dreaded	3	3	1	1	They dreaded the consequence of exploring the route by Mendon and the Honeoye valley for fear of its branching across the Genesee River to intersect the Caledonia and LeRoy Railroad to Batavia .
65554777	order	dread	3	3	1	1	They dread the order `` Over the top !
66452383	visit	dreading	32	32	30	30	This comment , as well as an earlier conflict he had with Chris Rosenberg , Roy ' s second-in-command , damaged his relationship with the crew and led to him dreading every visit to the Gemini Lounge to collect Nino ' s weekly payments .
67076785	uproar	dreading	10	10	8	8	The narrator tries to discourage the relationship , dreading the uproar such a marriage would cause back home in England ; however , he has no objection to the lady , whom he considers very beautiful and noble .
67182330	destruction	dreads	9	9	6	6	The Moon carries a face that dreads its inevitable destruction .
67218923	activity	dreads	6	6	4	4	The more a person dreads an activity , the higher its perceived risk and the more that person wants the risk reduced .
67224969	accession	dread	13	13	11	11	The more splendid his prospects the more reason he had to dread the accession of a family which was well known to be partial to the Whigs , and there is every reason to believe that he was one of those politicians who hoped that they might be able , during the life of Anne , to prepare matters in such a way that at her death there might be little difficulty in setting aside the Act of Settlement and placing James Francis Edward Stuart on the throne .
67839738	rival	dreaded	17	17	15	15	The most important game was to follow , for next up was Wapak ' s dreaded arch rival , the Botkins Reds .
68045856	wedding	dreads	19	19	17	17	The play follows Zafira , an Arabian princess , who mourns the loss of her husband and dreads the wedding with the Turkish pirate , Barbarroja , who wants to rule the coast .
68566389	treatment	dreaded	36	36	39	39	Then , there came the additional agony of his psychic ailment , for which he had to be admitted to the hospital where he was given electric shocks to cure him of his insanity - a treatment which he dreaded .
68698092	intrusion	dreading	9	9	7	7	The Persian king , Chosroes I , dreading the intrusion of Turkish influence , refused to allow the old commerce to continue .
70419920	outbreak	dreading	8	8	6	6	We have much typhoid and are dreading an outbreak , so I am directing my energies to getting the water of the Modder River boiled .
70521314	journey	dreading	21	21	16	16	We follow Jesse and Luke as they begin living together as a real couple , without dreading Sunday nights and Lukes journey back to London .
71117066	power	dreaded	16	16	14	14	When Didius Julianus was put to death by order of the Senate , who dreaded the power of Septimius Severus , the latter turned his arms against Pescennius Niger .
71236128	day	dreading	4	4	2	2	Vandals are dreading the day Nick gets those two tools .
72050928	return	dread	48	48	45	45	The tendency to slip into the genre convention of sludgy opening riff followed by tuneful verses and soaring refrains would be more acceptable if said riffs were anything to write home about , but they ' re too often so uninspired and anachronistic that you dread their post-chorus return .
72068112	confusion	dreading	15	15	11	11	The townspeople began to look on the event with disdain , dreading the filth and confusion that cluttered their city .
72070120	B	Dreaded	6	6	3	3	The Town That Dreaded Sundown Charles B .
72345740	idea	dreads	16	16	14	14	The two later argue , but they eventually reconcile , and Kristina explains she dreads the idea of her daughter dying in an accident .
73461084	husband	dreaded	44	44	38	38	Uc also wrote an erotic alba , Per grazir la bon ' estrena , in which , like his contemporary Guiraut Riquier , he desires the dawn to arrive , in contrast to earlier troubadours , who always dreaded the dawn and the jealous husband .
75112804	HVP	dreading	15	15	13	13	Yes Sir , the floor is all yours , except that I am dreading another HVP Mandal-ish question -LRB- Q5 in this round for the uninitiated -RRB- from you .
75632010	arrival	dreading	43	43	40	40	With the son ' s luggage unloaded and waiting next to them , there is nothing left for him to do but signal the train to stop , and his pose suggests that he is looking up the track , dreading the imminent arrival of the train that will carry his son away .
75790943	time	dreads	26	26	24	24	Yakumo is scouted by several High school clubs because of her many talents ; however , she declines joining most of them because she dreads spending time with Hanai who follows her with the intent of joining the same clubs .
76473754	restoration	dreading	41	41	39	39	When the questors called upon the Chamber to have posted up in all barracks the decree of 6 May 1848 concerning the right of the Assembly to demand the support of the troops if attacked , the Mountain , dreading a restoration of the monarchy , voted with the Bonapartists against the measure , thus disarming the legislative power .
77016831	Reign	Dreaded	18	18	16	16	Very little has been heard of the project since the release of the third album , Dreaded Chaotic Reign , in 2002 .
77249970	second	dreaded	10	10	8	8	While Isiris invaded Chronos , however , Mikeal dreaded every second of it , especially the attack on Temple Mercenaries Headquarters .
77453090	visit	dreads	7	7	4	4	Woolf both welcomes and dreads an afternoon visit from her sister Vanessa -LRB- Miranda Richardson -RRB- and her children .
