sentence_id	n	v	n_first_index	n_last_index	v_first_index	v_last_index	sentence_text
56200366	being	mind	8	8	5	5	So I really do not mind the above being said here since it seems to be the appropriate place .
56214023	parting	mind	5	5	4	4	Some organizations did not mind parting with their antiquities , since they were often an alien group of objects among larger collections of for example biological or geological specimens .
56291629	business	mind	12	12	10	10	Sorry DF but in this case I can only say mind your business and speak on a subject in which you are A RECOGNIZED AUTHORITY .
56323837	business	mind	10	10	7	7	So what you ' re saying is mind your own business and let people do what they feel like making-up policy as they go .
56456163	chasing	mind	14	14	11	11	South African skipper Trevor Goddard later said `` We did not mind the leather chasing , when he played so charmingly '' .
56552818	plank	mind	16	16	14	14	So please , before you lecture others about the speck in their eye , mind the plank in yours .
56553562	behaviour	mind	4	4	2	2	So please mind your behaviour , you were warned .
56644172	edit	mind	8	8	6	6	Stated differently , I do not mind an edit if it is an improvement , but I can not see how the outright deletion was an improvement .
56719225	line	mind	21	21	18	18	Steady , boys , ' ' Do not fire , ' ' Close up , ' ' Never mind the skirmish line , ' as that of the enemy hastened to shelter .
56781997	aswell	mind	22	22	21	21	Sticking keys , a damaged keyboard , a bad connector , a dodgy driver and a prank virus all spring to mind aswell , on top of what JSBillings and Diletante say .
56800697	story	mind	25	25	23	23	Steiner ' s appropriateness in composing the film ' s music , and says that Steiner ' s cues `` immediately call to mind the story of Howard Roark .
56853091	work	mind	30	30	27	27	Some customers balked at having to pay three cents for each grocery bag and having to pack their own groceries , but most said they did not mind the extra work .
56893617	object	mind	25	25	5	5	Some BLP subjects do not mind being included in Wikipedia , some do not mind so long as their coverage is accurate , a few object vehemently to inclusion , and there is also the related phenomenon of subjects determined to be non-notable and deleted who object to that conclusion and want their articles back in .
56895795	tellin	mind	10	10	9	9	Somebody who knows the Lord Jesus and do not mind tellin ' about it .
56907939	mischief	mind	14	14	13	13	Some Minds are more aggressive , some more calm ; some do not mind mischief , others simply demonstrate intellectual curiosity .
56963447	song	mind	32	32	27	27	Song titles are usually selected after the songs are recorded ; the band listen to the finished recording to see what kind of ideas it brings to mind , and name the song accordingly .
56967302	Ogg	mind	12	12	5	5	Son , I do not mind those two -LSB- Father and Grandpa Ogg -RSB- insulting each other , but I think your father went just a little bit too far when he and Grandpa went out in the hot sun to play Croquet and Grandpa had a stroke - - and your father made him count it .
57083658	opulence	mind	11	11	9	9	Sri Krishna ' s family too , does not mind the opulence they have .
57166003	kind	mind	6	6	4	4	Some people might not mind that kind of slavery .
57251007	weapon	mind	29	29	27	27	Some offences carry minimum sentences , for example , certain firearms offences , `` three strikes and you ' re out '' burglaries , using someone to mind a weapon , or those committed by dangerous offenders .
57278199	kind	mind	6	6	4	4	Some learners do not mind this kind of solo learning , but others find it a major stumbling block to successful completion of courses .
57288545	hatred	mind	27	27	21	21	Some of the comments on YouTube make you weep for the future of humanity just for the spelling alone , never mind the obscenity and the naked hatred '' .
57531660	ice	mind	20	20	17	17	The collection was distinguished by the presence of thick glass with a rough surface that brought to mind snow and ice , replacing in one blow the smooth , thin , streamlined colored glass of the 1950s .
57563442	folk-pop-rock	mind	37	37	34	34	The combination of male-female harmonies , optimistic lyrics with shades of romantic psychedelia , folk-rock melodies , acoustic-electric six - and twelve-string guitar combinations , and stratospheric orchestration could not help but bring to mind similar Californian folk-pop-rock of the mid-to-late 1960s .
57627688	weapon	mind	88	88	86	86	The following laws apply to the controlled use of knives in the UK ; possession of an offensive weapon in a public place -LRB- section 1 Prevention of Crime Act 1953 -RRB- ; the possession of a bladed or pointed article in a public place -LRB- Section 139 Criminal Justice Act 1988 -RRB- ; trading in flick or gravity knives -LRB- restricted under the Offensive Weapons Act 1959 -RRB- , the unlawful marketing of combat knives and publishing adverts for combat knives and using someone to mind a weapon -LRB- Violent Crime Reduction Act VCRA 2006 -RRB- .
57669421	attitude	mind	27	27	24	24	The focus of Canto CI is around the Greek phrase kalon kagathon -LRB- `` the beautiful and good '' -RRB- , which calls to mind Plotinus ' attitude to the world of things and the more general Greek belief in the moral aspect of beauty .
57688204	pear	mind	19	19	15	15	The flavor of Prosecco has been described as intensely aromatic and crisp , bringing to mind yellow apple , pear , white peach , and apricot .
57779327	work	mind	4	4	9	9	The final , full-scale work that Friel had in mind while writing Performances was The Home Place -LRB- 2005 -RRB- , the last of his plays set in Ballybeg .
58061827	pollution	mind	20	20	19	19	The Doctor realises that the buzzing noise no-one else can hear is a brainwashing beam telling people to not mind pollution .
58079130	government	mind	33	33	30	30	The dreaded instrument became synonymous in Western European languages with what was seen as the tyrannical cruelty of the autocratic government of Russia , much as the sjambok brought to mind the Apartheid government of South Africa or the bullwhip was associated with the period of slavery and Jim Crow laws in America .
58128460	lament	mind	12	12	9	9	The dotted rhythm in its first bar calls to mind the oboe lament from the beginning of the movement .
58153223	maskim	mind	13	13	10	10	The exotic names Ackroyd gives to these demons bring to mind the seven maskim of Babylonian occultism .
58186264	god	mind	33	33	30	30	The exhibition also explores how Twombly is influenced by antiquity , myth and the Mediterranean , for example the violent red swirls in the Bacchus 2005 paintings which bring to mind the drunken god of wine .
58227744	kind	mind	8	8	5	5	The fake backdrop calls to mind also the kind used by photographers that feature a painted body on a sheet of wood with a hole cut out where the head belongs popular at holiday venues .
58311954	car	mind	60	60	58	58	The front part sloping , in the grid to elements horizontal and vertical there are references to torpedo and especially Bandini 750 sport internazionale The headlights are on the disappearance like the first Bandini but seats on the front wheel just above a thin optical groups shaped and arrears compared to central air-intake thereby helping to draw to mind the car with wheels discoveries .
58587089	bastard	mind	12	12	9	9	The former president tells Cantwell that he does not mind a `` bastard '' but objects to a stupid one .
58588232	image	mind	24	24	22	22	The former root expression paints a picture of someone who is extraordinarily happy and excited , whereas the latter root brings to mind the image of a person who is extremely clumsy .
58747556	business	mind	18	18	15	15	The editor responded by removing all of the cleanup tags and putting an aggressive `` mind your own business '' reply to me on their Talk page .
58886693	force	mind	3	3	8	8	The ideal police force that Quadri has in mind should have `` more than 350 , 000 officers that are qualified and well paid , '' so they can reach the standard of the police forces in Colombia and Chile .
58889351	thought	mind	8	8	6	6	The idea of deletion brings to mind the thought of censure and other forms of social control .
58937915	business	mind	16	16	13	13	The men promptly turned and asked the search party to leave , and mind their own business .
58937916	business	mind	17	17	14	14	The men promptly turned and asked the search party to leave , and to mind their own business .
59193597	possibility	mind	17	17	15	15	The insulation on ancient wiring can quite easily crumble and cause a fire , never mind the possibility of shocks .
59289267	idea	mind	16	16	14	14	The likelihood of Texans agreeing to name their state something besides Texas , never mind the idea of reshaping it , is roughly that of Texas issuing an official pardon to Santa Anna .
59340358	collaboration	mind	3	3	8	8	The level of collaboration that DionysosProteus has in mind for inclusion in the category will not be shared by other editors .
59422243	venue	mind	14	14	12	12	The landlord , local police , and neighbors did not seem to mind the venue during the first few years of operation , but slowly baseless rumors began to circulate in the community that the house was associated with Satanism and underage drinking .
59566909	atheism	mind	13	13	9	9	The man is deeply religious , but does not mind Alice ' s atheism , and respects her convictions .
59637584	Master	mind	34	34	32	32	The Loverly Invasion '' -RRB- is clearly based on The Claws of Axos with a race of beautiful aliens arriving on Earth ; Finally , the recurring villain Doctor Klench brings to mind the Master - even going as far as carrying around his miniaturized victims -LRB- still living -RRB- with him .
59689389	age	mind	41	41	39	39	The lyrics from several songs from her 2009 album I Feel Cream tackle the issue of age , including Trick or Treat -LRB- `` you lick my crow ' s feet '' -RRB- , Show Stopper -LRB- `` Never mind my age , it ' s like we ' re breaking out of a cage '' -RRB- and Mommy Complex .
59733171	Support	mind	0	0	15	15	Support This article ' s prose uses a lot of semi-colons which I did not mind because I use them a lot as well .
59750553	crop	mind	10	10	8	8	That said , I hope you would not mind my crop of your photograph of the cannon -LRB- having the bannister as the central item seems to distract from the cannon -RRB- .
59771709	resolution	mind	23	23	21	21	That ' s what I call a reaction , there has not even been the opportunity for a dispute , never mind a resolution .
59780057	role	mind	14	14	11	11	That there are seven stars above her crown also call to mind the key role Mary played in Salvation History .
59800286	deluge	mind	11	11	8	8	That ' s just two sources , never mind the inevitable deluge of reception information that ' s going to be coming .
59801684	DYK	mind	12	12	10	10	Thats not even worthy of inclusion in the article never mind a DYK on the front page .
59884900	walk	mind	7	7	4	4	Students who do not mind the ten-minute walk from the stadium take advantage of the large carpark .
59906678	deal	mind	11	11	5	5	Strong Merge This is , mind you , a pretty big deal .
59936897	quote	mind	6	6	4	4	Support , bringing to mind a quote from The Hunt for Red October .
59948686	arc	mind	13	13	8	8	Surat said that while he `` did not mind '' the first filler arc with the Christianity sect , he could not stomach the final two filler arcs , and Japanese audiences disapproved of the final two filler arcs .
59949435	block	mind	14	14	11	11	Sure , and based on his behaviour , I do not mind the indef block , I was more thinking ahead towards others in the future that could get that IP-number .
60037629	fact	mind	21	21	19	19	That Beyond My Ken is not happy with this development does not mean his views trump policy -LRB- never mind the fact that policy is not fully up to date -RRB- .
60038773	problem	mind	5	5	3	3	That brings to mind another problem I have with this article - - not just a sprawling list of statistics , but a synthesis - - not very good synthesis either - - of percentages of selected religions , ethnic groups and nationalities .
60038774	image	mind	6	6	3	3	That brings to mind a similar image but I ca not think of where I ' ve seen it .
60038775	taker	mind	10	10	3	3	That brings to mind the old one about a census taker in a place with a high Asian-American population , San Francisco perhaps .
60039487	application	mind	7	7	3	3	That called to mind Berlin ' s application to host the games in 1936 .
60039518	line	mind	8	8	3	3	That calls to mind an -LSB- -LSB- assembly line -RSB- -RSB- .
60040490	business	mind	6	6	3	3	That ca not mind her own business .
60128888	store	mind	6	6	4	4	Terah left Abram to mind the store while he departed .
60162324	light	mind	6	6	2	2	Support Never mind the blurry red light .
60162325	count	mind	7	7	3	3	Support - never mind the smaller-than-some edit count .
60164630	sky	mind	7	7	4	4	Support Not that I mind the overcast sky in the original shot ; it is London , after all .
60209334	abstinence	mind	19	19	17	17	Tchaikovsky could have convinced himself that Antonina had no problem with his sexual preferences and would not mind marital abstinence .
60249061	business	mind	26	26	23	23	Tatsuya believes he can help her although his friends only see her as a masochist pervert , and Seine herself told him to mind his own business .
60370830	fact	mind	18	18	16	16	TGAOTU -RRB- , and was a bad sub-stub until this AfD was filed , and never mind the fact that the person who removed the prod did nothing to the article either .
60417994	transaction	mind	32	32	30	30	Stone claims he has Attention Deficit Disorder -LRB- ADD -RRB- `` so severe he never finished a martini , a cigar , a thought , or a sentence , never mind a transaction .
60560641	afield	mind	16	16	14	14	Teams are often unheard of and usually unfollowed within their own institution , never mind further afield .
60582145	business	mind	7	7	4	4	Telling an admin to mind his own business , when this board is designed for precisely what MastCell is doing , is clearly out of line here .
60583852	knitting	mind	6	6	4	4	Tell mu mind to mind his knitting , and stick to softwear , or prove he knows more about Dyshidrosis than I do .
60621530	value	mind	39	39	36	36	Technology website CNET stated how the phone has `` a wealth of great software features and a ridiculously low price '' , and how it is `` almost certainly the best Android device around , never mind the best value '' .
60624498	house	mind	26	26	24	24	Ted and Dougal attempt to make Father Stone leave ; they say that they ' re going on holidays , but he offers to mind the house while they ' re gone .
60646904	era	mind	10	10	6	6	Tapie ' s arrival brought to mind the Marcel Leclerc era , with stars swarming to the V e lodrome and success trailing close behind .
60724116	Gradation	mind	38	38	32	32	Subsuming all the work of nearly 30 years , including and surpassing the remarkable `` Homage to Mistress Bradstreet , '' Berryman seems to have grown in a progress that calls to mind Andre Gide ' s `` Gradation , gradation - - and then a sudden leap .
60793794	bit	mind	12	12	10	10	Take a break , get some coffee to clear you mind a bit .
60850791	fancruft	mind	10	10	9	9	T-600 -LRB- fictional character -RRB- I usually do not mind fancruft , but I do not see the point with this one .
60882182	control	mind	16	16	15	15	Tachyon , who despises Digger and , when confronted by him , often resorts to mind control to make Digger humiliate himself until he goes away .
60927392	control	mind	6	6	5	5	Sutekh subjects the Doctor to mind control and returns him to the priory as another of his servants .
60958421	world	mind	24	24	21	21	Symbolist painters mined mythology and dream imagery for a visual language of the soul , seeking evocative paintings that brought to mind a static world of silence .
61068195	business	mind	21	21	6	6	The citizens of Owensboro did not mind having a female sheriff and thought that she was handing the county ' s business well .
61097264	proposition	mind	11	11	7	7	The close-up of the branches brings to mind Delacroix ' s proposition that `` even a part of a thing is kind of a complete entity in itself .
61316864	controller	mind	37	37	33	33	The detectors are what you want to detect the light but you probably want both the emitters and detectors , it can be quite hard enough working with the changing ambient light never mind the occasional TV controller .
61389806	game	mind	10	10	8	8	The card motif is meant to bring to mind a game of poker , as often seen in western movies .
61726957	canvassing	mind	12	12	8	8	The entirety of his editing here , never mind his explicit off-site canvassing for new partisans for just that purpose , demonstrates such contempt for the goals of the encyclopedia as I ' ve rarely seen equaled among established editors .
61789694	aspect	mind	9	9	5	5	The elderly people do not mind this rather gruesome aspect of the drug , but upon seeing Homer ' s antics with his friends and his car , Grampa convinces the old people to stop using the pills , saying that the Baby Boomer generation still needs their guidance , and this is only possible with their constant nagging .
61794368	course	mind	12	12	10	10	The death of Rabbi Arthur Hertzberg this week called to mind a course I took as a Brandeis undergraduate with the legendary YIVO Institute for Jewish Research scholar , Zosa Szajkowski .
61812934	Pillar	mind	24	24	21	21	The deambulatory also includes an unusual pillar in the form of the trunks of a palm tree , that brings to mind the Apprentice Pillar at Rosslyn Chapel .
61893019	Dr	mind	9	9	7	7	The culmination of the experiments was to mind transfer Dr .
61970657	body	mind	19	19	24	24	The beginning is similar , with Number Two meeting the Colonel , here named Oscar , the man whose body Number Six ' s mind will occupy .
62007040	business	mind	8	8	5	5	The best course is to mind your own business when it comes to the race , religion , age and sexual orientation of your customers .
62086138	template	mind	7	7	5	5	Striver does not seem to mind the template as demostrated on the template talk page .
62097054	adage	mind	22	22	19	19	Stryper beat out all of their competition to be named the Best Christian Hard Rock Band , bringing to mind the old adage , ' like a fine wine , some things just get better with age .
62145325	safety	mind	11	11	9	9	The Court also noted the Jews had offered to mind fire safety .
62256714	behaviour	mind	30	30	28	28	The Council found that Howth had no basis for his charges other than his unpopularity with his fellow nobles , and ordered him to remain at home and mind his behaviour .
62276616	work	mind	42	42	37	37	The school seeks to foster the Three C ' s -LRB- `` courage , compassion and commitment '' -RRB- in its students , who are admitted because `` they demonstrate a love of learning and do not mind a bit of hard work .
62326299	founder	mind	11	11	17	17	There was one -LRB- Schaeffler Group -RRB- that linked to the founder , which I do not mind too much , but presumably if it made them billions then the actual group would warrant an article of its own .
62408489	film	mind	15	15	13	13	The question about the film with the drowning kid above , brought to mind another film .
62409061	piece	mind	6	6	4	4	The question brings to mind a piece of colloquial English possibly not understandable to those for whom English as a second language , or even those speaking a non-UK variety of English .
62409063	Darkness	mind	5	5	4	4	The question brought to mind Darkness at Noon , a novel whose original German manuscript was lost but was recreated from an English translation .
62409242	idea	mind	29	29	27	27	The question does not state that any investigation has taken place , so it is not a lie , but it puts in the respondent ' s mind the idea that Candidate Smith may be corrupt .
62413238	matter	mind	12	12	10	10	The question of a catalog was to Cogswell ' s mind a matter of prime importance .
62545002	set	mind	23	23	20	20	There were alot of changes from the future tense to the past or present tense , and I would not mind an extra set of eyes to make sure everything makes sense .
62672567	business	mind	25	25	23	23	The Roman law , as also the Roman-Dutch law , recognises the principle that , generally speaking , no one is bound to mind the business of another , even where he can , with no danger or expense to himself , avert serious harm from the other , and that no liability is incurred by refraining from doing so , even if the omission should violate a moral duty -LSB- .
62680891	basis	mind	15	15	22	22	There was no actual fault or privity on the part of Great Lakes on the basis that Captain Kelch was a directing mind of the corporation .
62728523	behavior	mind	13	13	11	11	The sailors are given shore leave with a stern warning to mind their behavior when they land in the Japanese port of Kowana .
62859715	myth	mind	11	11	9	9	The seminal artistic creativity of those times brings to mind the myth of Orpheus to whom Apollo gave a lyre and the Muses taught to play and sing .
62884529	series	mind	36	36	33	33	These plates , executed from 1850 to 1854 , are never found as a set and were never expressly published as such , but they nonetheless constituted in M e ryon ' s mind an harmonious series .
62900498	death	mind	26	26	7	7	The Robinson family was of an artistic mind and advised on the embellishment of the house in the six years until Theresa ' s tragic early death .
62989718	offhand	mind	15	15	14	14	There would be many difficulties with an infrared-sensitive retina ; ones that come to mind offhand are the infrared emitted by our own bodies -LRB- including our eyes -RRB- , and the infrared-opaque nature of some components of our eyes .
63033430	everyone	mind	8	8	6	6	These devices have the power to mind control everyone in the world .
63094554	circa	mind	16	16	13	13	The second track `` Stoned '' has a dance vibe , bringing to mind David Bowie circa Outside -LRB- 1995 -RRB- .
63176562	name	mind	12	12	9	9	The secondary reason is that although I do not mind my last name being displayed for the world to see , I would prefer to be known as ' Jamie ' .
63193109	rock	mind	21	21	13	13	These are darkly heartfelt , enigmatic and melodic songs that often bring to mind a mix of the yearning , expansive rock of the Smashing Pumpkins and the soulful AM pop of Todd Rundgren .
63275220	way	mind	12	12	22	22	The same opinion of course has been expressed in an even stronger way by sysop RickK , which Ugen apparently does not mind .
63299637	massacre	mind	9	9	6	6	The scale of killings brings to mind the word massacre .
63375718	concerto	mind	55	55	53	53	The German word Concert -LRB- modern spelling Konzert -RRB- could mean both concert and concerto , but the titles Grosses Concert-Solo or Grand solo de concert seem just to denote a large-scale concert piece -LRB- as opposed to a short salon piece for example -RRB- , whereas Concerto path e tique calls to mind a concerto .
63581215	notion	mind	12	12	10	10	The isolation , resonance of this music can bring to mind the notion of the Music of the Spheres .
63626234	commute	mind	12	12	10	10	The island is also host to visitors who do not mind a commute to the popular destination of Key West .
63646786	intent	mind	23	23	21	21	Their purpose is to write minimal notes which will , at a quick glance , elicit in the interpreter ' s mind the intent of an oral communication so that it can be re-expressed in a different language .
63677245	pop	mind	34	34	32	32	Their sound is categorized as indie rock , folk rock , experimental rock , alternative rock , or just rock , blending lush , complex arrangements with sing-along choruses that bring to mind folk-inflected pop and well-written novellas .
63833570	business	mind	26	26	23	23	The independent New York Herald wrote , `` If Minister Willis has not already been ordered to quit meddling in Hawaiian affairs and mind his own business , no time should be lost in giving him emphatic instructions to that effect .
63939312	body	mind	21	21	13	13	The feeling of solitude and oneness with god will do wonders to you mind and have a positive effect on you body .
64011648	thinking	mind	40	40	36	36	The fan reaction , however , was far more positive than negative , and trade magazines began referring to them as `` the next Statesmen '' , implying that the mold-breaking style they created brought to mind the similarly outside-the-box thinking of the classic group .
64113881	Crown	mind	25	25	23	23	The grape leaves stand for the grapes from which the wine of the Last Supper was pressed , while the thorns call to mind the Crown of Thorns , and the sheep is a reminder of the Sacrifice of Christ .
64467700	level	mind	6	6	4	4	Though I do not mind the level of `` scientificness '' -LRB- even if it is mostly too difficult for me also -RRB- , I think it would be better if it would be toned down a bit in terms of that .
64508029	business	mind	24	24	21	21	Thus , in England -LRB- and elsewhere in Medieval Europe -RRB- the general tendency was for the Upper Class nobiility to mind their own business of making money from their own lands out in the country .
64528171	way	mind	20	20	17	17	Timeshift has been asked or told on a number of occasions - going back years - to mind the abrasive way in which he uses his userpage .
64604319	appreciation	mind	6	6	4	4	Though she would not mind more appreciation now and again , Jean is always kind and generous to everyone and loves nothing more than her family .
64626889	basquasher	mind	31	31	24	24	Though Dan was the most oblivious to her gender , he says , once she reveals her real name , that he does not mind , since she is a ' basquasher ' like everyone else .
64631883	ideology	mind	14	14	12	12	Though this might seem like simple discourse , the dialogue brings to mind the ideology of previous decades which held that African Americans were simply property , and therefore had no rights .
