sentence_id	n	v	n_first_index	n_last_index	v_first_index	v_last_index	sentence_text
17137378	editing	mind	13	13	7	7	I do not need your certificate , mind your own business and happy editing as the wiki rules .
17141602	canvassing	mind	14	14	13	13	I do not see why preference for standard operating procedure should bring to mind canvassing .
17149328	bit	mind	6	6	4	4	I do not always mind a bit of rough-and-tumble in the heat of things on Talk pages and in edit summaries , but it ' s a chore to have to defend '' perfectly routine and proper '' behavior -LRB- even if all I really needed to do was point people to the pertinent discussions -RRB- and it ' s a further chore to keep checking in to make sure that I have not , through some quirk , been sanctioned anyhow .
17170020	archiving	mind	6	6	3	3	I did not mind the manual archiving at all , please see .
17170021	title	mind	6	6	3	3	I did not mind the new title , just the fact that he deleted content .
17173310	bot	mind	5	5	3	3	I do not mind a bot coming along and redirecting -LSB- -LSB- Mercury -LRB- disambiguation -RRB- -RSB- -RSB- to -LSB- -LSB- Mercury -RSB- -RSB- -LRB- which already does by the way , but that ' s just an example .
17173312	call	mind	5	5	3	3	I do not mind a call to action , in order to improve the article , in fact I welcome it for any article .
17173313	checking	mind	5	5	3	3	I do not mind a checking of my contributions , but I do not like it when someone is willing to take something so far as a legal threat and my possible blocking when all I ' ve done is try to enforce the rules with both myself and others so as to make Wikipedia a better place !
17173314	prod	mind	6	6	3	3	I do not mind a contested prod , but it does seem like it should be based on something other an editor ' s amusement value .
17173315	debate	mind	5	5	3	3	I do not mind a debate around issues like decriminalisation .
17173318	biography	mind	6	6	3	3	I do not mind a fair biography but this is hurtful rubbish .
17173319	d	mind	11	11	3	3	I do not mind a high edit count , I ' d rather not cheat my way into it .
17173321	article	mind	5	5	3	3	I do not mind an article on a starring robot like R2D2 but , according to this article , the R7 Droids were another fictional brand of robots that the hero did not use .
17173325	anyone	mind	4	4	3	3	I do not mind anyone appealing for a deletion , but an editor or administrator should have to work at least as hard in removing an article as I ' ve had to in defending one .
17173326	anyone	mind	4	4	3	3	I do not mind anyone overturning my block for an extension .
17173330	critique	mind	5	5	2	2	I dont mind a proper critique , but slandering something you dont understand as nonsense I wont tolerate .
17173331	request	mind	5	5	3	3	I do not mind a request for protection one bit .
17173332	page	mind	6	6	3	3	I do not mind a separate page on Wikipedia which lists the various disclaimers , but that is hardly a good reason to fill perfectly good articles with non-encyclopedic material .
17173333	sentence	mind	6	6	3	3	I do not mind a short sentence describing his position , but only that-and no spurious criticism , no matter how great prospect agazine thinks the authors are .
17173348	sub	mind	6	6	3	3	I do not mind a u-fix-it sub .
17173368	m	mind	16	16	3	3	I do not mind being over my head as long as I know where I ' m going .
17173384	Californian	mind	4	4	3	3	I do not mind Californian too much , though - as I said - I tend to prefer northeastern accents .
17173398	m	mind	22	22	3	3	I do not mind dealing with this person , however I ' m concerned that it could be interpreted that I ' m flouting the ruling .
17173399	debate	mind	4	4	3	3	I do not mind debate , but I do not like to be insulted .
17173403	deletion	mind	4	4	3	3	I do not mind deletion , but a more verbose explanation would allow me to be a better contributor !
17173417	Durova	mind	4	4	3	3	I do not mind Durova ' s block , but obviously I did not think this was that big a deal .
17173419	editing	mind	4	4	3	3	I do not mind editing alongside an editor who has strong feelings , but pulling this into an arbitration case to cram his version of the article on everyone else , seems like a big waste of time - - especially when I already have a relatively small amount of time to edit .
17173423	way	mind	5	5	3	3	I do not mind either way , but we all have to agree beforehand .
17173424	way	mind	5	5	3	3	I do not mind either way , however it seems to be getting more involved that a simple EL should have become , so some neutral oversight would be appreciated .
17173425	BUT	mind	12	12	3	3	I do not mind either way if CIA is used or not BUT we must have consistency .
17173428	commentary	mind	6	6	3	3	I do not mind extremely negative commentary on the RfC itself , but not where it makes wholesale changes to the text and falsifies the process .
17173430	comment	mind	5	5	3	3	I do not mind fair comment on my work but I do not think that this article adds any value .
17173507	fact	mind	24	24	22	22	I do not mind if the community decides that mindless adherence to a calendar is the right solution , but I do mind the fact that not one single editor appears to have even noticed this nearly week-long unpleasantness .
17173528	em	mind	28	28	3	3	I do not mind if you pronounce it Frenchly -LRB- I know English does not have words like Frenchly , but Esperanto does , and I like ' em -RRB- like ' otel .
17173535	editing	mind	5	5	3	3	I do not mind IPs editing as a `` try before you buy '' way of dipping your toe into Wikipedia , but for experienced editors , it usually indicates they have a problem with authority or have something to hide .
17173549	sarcasm	mind	5	5	3	3	I do not mind little sarcasm , but that last idiom sounds very '' unwikipedian '' to me .
17173560	name	mind	5	5	3	3	I do not mind my name being used , I just think it is reasonable to expect to be notified in such case .
17173562	show	mind	5	5	3	3	I do not mind my show being supernatural , but I do not want to be booked into a graveyard every week .
17173563	fairness	mind	6	6	3	3	I do not mind neutrality or fairness or competitiveness , but keep in mind that we are an encyclopedia .
17173565	myopia	mind	13	13	12	12	I do not mind notable pop culture topics being covered but do mind myopia about things in popular culture that should receive encyclopedic coverage in WP but have not yet .
17173584	anything	mind	6	6	3	3	I do not mind pretty much anything a user claims themselves to be , but claiming others ' opinions seems problematic .
17173591	recreation	mind	4	4	3	3	I do not mind recreation if this article can be expanded .
17173598	discussion	mind	5	5	3	3	I do not mind robust discussion , but this individual has overstepped the mark .
17173599	sarcasm	mind	4	4	3	3	I do not mind sarcasm , myself , but these reactions do not propel consensus .
17173602	scanning	mind	4	4	3	3	I do not mind scanning it from a book if someone has a reference .
17173603	sentimentality	mind	4	4	3	3	I do not mind sentimentality , as long as it ' s not calculated .
17173607	conversation	mind	6	6	3	3	I do not mind some off-topic conversation , but it seemed like some sudden negative material unrelated to the topic at hand .
17173609	someone	mind	4	4	3	3	I do not mind someone pointing out if I ' m being careless or if I ' ve made a mistake , but I think he was way out of line when he calls me a liar .
17173635	sock	mind	8	8	3	3	I do not mind the 3RR and the sock , they were both disproven , but the repeated personal attacks which I tried to simply remove but he puts back three times , is over the line .
17173636	work	mind	6	6	3	3	I do not mind the additional work I have to for the article , but I do not really need it either .
17173638	stalement	mind	6	6	3	3	I do not mind the apparent stalement -LRB- barring last-minute developments -RRB- ; for some reason , it ' s hard to get people to talk seriously about pros and cons of Pending Changes -LRB- PC -RRB- as long as they ' re hoping to `` win '' on sheer numbers .
17173639	article	mind	5	5	3	3	I do not mind the article and can see room for improvement .
17173640	article	mind	5	5	3	3	I do not mind the article being teared down for now .
17173641	article	mind	5	5	3	3	I do not mind the article , it ' s just a selective list of major news stories from the last few years , but I do not think this kind of news review belongs on Wikipedia .
17173642	blurb	mind	5	5	3	3	I do not mind the blurb , just do not like its position on article pages .
17173643	d	mind	16	16	3	3	I do not mind the chart information or even the chart trajectory tables - I ' d just like some more musical information as well .
17173644	concept	mind	5	5	3	3	I do not mind the concept , but I have a lot of problems with it .
17173645	version	mind	6	6	3	3	I do not mind the divergent version getting an separate article , as we have it now , since it ' s not the Ten Commandments of popular perception , but I do think that the text of all three versions should be placed side by side for comparison in the main article , at least unless we have some consensus to delete one of them .
17173646	drawing	mind	5	5	3	3	I do not mind the drawing , but labeling .
17173649	expense	mind	5	5	3	3	I do not mind the expense if it is something the dog needs , but they will have to knock him out with anesthesia to do it .
17173651	part	mind	6	6	3	3	I do not mind the first part of the remedy , which places the article on 1RR , but the second part I believe should be canceled .
17173652	image	mind	4	4	2	2	I dont mind the image as long as its ok to use .
17173653	incivility	mind	5	5	3	3	I do not mind the incivility so much , but the fact is that yesterday I spent more than three hours in the library looking up sources and writing a detailed explanation , with numerous citations , why the `` Rothschild as Hitler ' s grandfather '' claim is a tiny-minority view that does not merit inclusion .
17173654	ban	mind	6	6	3	3	I do not mind the interaction ban .
17173656	section	mind	10	10	3	3	I do not mind the long `` Publication history '' section , but the style on Wikipedia tends toward subdivided sections .
17173657	look	mind	6	6	3	3	I do not mind the `` look '' of the outcome , colors etc .
17173663	back-and-forth	mind	6	6	3	3	I do not mind the ongoing back-and-forth here , but I do object to such unilateral attempts to remove what this user apparently sees as embarassing material .
17173664	picture	mind	5	5	3	3	I do not mind the picture being used , it is not my intellectual property to begin with , and I think it serves a special purpose .
17173665	ref	mind	5	5	3	3	I do not mind the ref to symbolism in first line as it is instantly recognizable as such and heavily connected with US emblem .
17173668	sight	mind	5	5	3	3	I do not mind the sight of blood or anything , it ' s just the idea of something not functioning correctly -LRB- I think -RRB- .
17173669	squeak	mind	5	5	3	3	I do not mind the squeak too much , meself .
17173670	part	mind	5	5	2	2	I dont mind the stalking part , its the hassle of him bothering me with it everytime I refresh my watchlist .
17173671	style	mind	4	4	2	2	I dont mind the style of the diagram , as long as its accurate or uptodate .
17173672	sun	mind	5	5	3	3	I do not mind the sun sometimes ; the images it shows ; you never know just how you look through other people ' s eyes .
17173674	discussion	mind	5	5	3	3	I do not mind this discussion here now , but I am concerned that VP is not ultimately a good place for discussion about the sandbox , because stuff is briefly discussed and then archived , making it difficult to find past discussions on any particular topic .
17173683	editing	mind	5	5	3	3	I do not mind unregistered editing from stable IP addresses and stable proxies , but the current dilemma is a major resource drain .
17173684	userfication	mind	5	5	3	3	I do not mind ' userfication ' , it ' s ' decategorization ' that I strongly object to .
17173691	violence	mind	4	4	3	3	I do not mind violence or drugs , all the kids in my household can handle that .
17173695	idea	mind	24	24	3	3	I do not mind whatever happening due to being booted off because I do not follow some political party line , or the nutty idea that my dozens and possibly hundreds of edits on the Khmer Rouge talk page , which go back several archives were not sufficient discussion .
17173706	WHERE	mind	4	4	3	3	I do not mind WHERE on a page the phoneticisations should go at all - they can have their own section if they really have to - but I do mind if they ca not be there at all , as they are just as valid information as any of the other stuff on such pages .
17173712	input	mind	18	18	3	3	I do not mind which , just so long as it sticks this time , and whatever WPJ input we might get is at least vaguely stub-guideline compliant .
17174581	image	mind	7	7	4	4	I do not personally mind his infobox image of the mosque , but I think one with the calligraphy of the name is easier to justify in terms of least astonishment etc .
17175732	way	mind	6	6	4	4	I do not really mind either way .
17175733	way	mind	6	6	4	4	I do not really mind either way , but I agree that Wikipedia articles are getting too complicated when viewed in an edit box .
17175734	matter	mind	29	29	4	4	I do not really mind him responding to people on his talk page or theirs , which is most of what he ' s been doing lately , no matter what ' s in his sig .
17175744	box	mind	7	7	4	4	I do not really mind the search box being moved up , but its new name is terrible .
17175745	tag	mind	5	5	3	3	I dont really mind the tag being placed , but a rationale and ideas for improvement would be appreciated , not the blanket statements Wikifan has been making that the article shouldnt even exist as a POV fork and so the POV tag has to be included .
17175746	m	mind	16	16	4	4	I do not really mind the updates , except when they interrupt whatever else I ' m trying to do .
17175748	TomBrown16	mind	6	6	4	4	I do not really mind , TomBrown16 I guess -LRB- I ' d like the most recent one -RRB- .
17179711	news	mind	25	25	23	23	I do not see how a source that supports Nazi-like anti-Jewish comments can be considered reliable for the time of day , never mind actual news .
17189525	redirect	mind	23	23	21	21	I do not think that ' s really enough to warrant an individual article just yet , though I would not mind a redirect if consensus goes that way .
17189633	edit	mind	10	10	8	8	I do not think that the casual vandals mind the edit not sticking .
17198076	name	mind	22	22	20	20	I do not want to go through the entire `` legally change my name '' process as I do not mind my name with my family and am quite attached to it - it ' s just a stupid name to use as a businessman .
17204694	template	mind	18	18	15	15	I did not create the infobox in the first place , so I would not mind the infobox template being removed .
17205102	stuff	mind	16	16	12	12	I did not even know you were blocked last night , never mind all the horrible stuff they are doing to you now .
17207612	book	mind	5	5	3	3	I did not mind this book , I probably would ' ve enjoyed it more if I was in grade 3-4 so on , but it was written by a very creative person with a good sense of humour .
17217039	unblocking	mind	46	46	43	43	I ' d interpret her comment , that the project was protected by a block , but that she was not making any decision about how long it would be , and she backed that up by immediately noting that she would not mind any admin unblocking .
17232789	mouth	mind	7	7	5	5	I do suggest that you mind your mouth .
17243416	time	mind	14	14	12	12	I doubt we can call it notable in a week , never mind any time in the future .
17248024	delay	mind	17	17	16	16	If A and B had previous dealings and are completely trustworthy , then they may not mind delay of one or two working days .
17268137	bot	mind	7	7	5	5	I do , however , mind a bot enforcing the policy .
17268138	idea	mind	5	5	3	3	I do however mind the idea of deleting an article about an apparently very notable person because people are too lazy to fact-check .
17271160	blanking	mind	5	5	2	2	I do mind however the blanking .
17271166	business	mind	5	5	2	2	I do mind my own business , but I also believe targeting only one user in such case is not quite a neutral stance .
17271168	lack	mind	4	4	2	2	I do mind the lack of edit summaries .
17271171	claim	mind	5	5	2	2	I do mind your counterfactual claim that I am unwilling to accept criticism .
17272667	ribbon	mind	24	24	22	22	I do not have anything against iGoogle as long as I can have the traditional google page -LRB- I do not really mind the ribbon .
17288232	look	mind	32	32	28	28	If anyone else is thought to have been swayed by the 2 hour long tweet , as I have stated on the talk page , I would not mind an impartial administrator look into this and strike out the doubtful !
17325796	business	mind	23	23	20	20	I feel like I strayed into a walled garden and the folks inside the walls are suggesting that I should mind my own business unless I want to join in the actual dispute .
17363231	answering	mind	26	26	25	25	I could probably find this by searching but a quick search did not find anything and it ' s so simple hope someone does not mind answering .
17384898	avenue	mind	27	27	25	25	If each is notable it would seem to lower the overall notability of railways by suggesting that every single one is worthy of mention never mind the avenue where it is located .
17386640	business	mind	18	18	15	15	If editors are in a dispute that has nothing to do with you , then mind your own business .
17393337	revert-warring	mind	35	35	33	33	I endorse this summary - simply looking at his talk page and the amazing quantity of blocks and continued rule-breaking there seems enough to justify a permanent block in my opinion , never mind his revert-warring and offensive edit summaries .
17393739	gal	mind	35	35	30	30	I enjoy doing research on the internet , sharing emails and photo ' s with friends and just being your all-American techno-challenged yet nice , quite intelligent , nonjudgemental , mind my own business American gal .
17394393	read	mind	20	20	15	15	I enjoy tackling music articles , preferably short ones ; however , I do not mind an interesting but lengthy read .
17397264	bit	mind	12	12	9	9	I even do that if they are dead never mind the living bit .
17413759	bit	mind	16	16	14	14	If someone else wants to create this instead of me , I do not mind a bit .
17419760	coz	mind	16	16	15	15	If someone would add a line about this in India , I definitely would not mind coz its important .
17451439	series	mind	12	12	10	10	If they do ever complete a whole episode -LRB- never mind a series -RRB- then I can see it standing a chance of becoming notable but it certainly should be deleted for the time being .
17452385	control	mind	9	9	8	8	If they do , they are susceptible to mind control by the orbs .
17514815	snow	mind	6	6	5	5	If the user did not mind snow , he could turn it off and get faster text output .
17550963	difference	mind	8	8	6	6	I figured the OP would not mind the difference , but it ' s a good thing to mention that nothing is certain in experimental physics .
17559208	refinement	mind	16	16	14	14	I find Blueboar ' s obsession with this source irritating , but would not mind some refinement of the standard footnote .
17612377	jot	mind	15	15	13	13	If I never created her article all those months ago , no-one would mind a jot if her article appeared now .
17619449	hygiene	mind	26	26	24	24	If I spend a full 10 hours in the bathroom , showering , shaving and brushing my teeth , I would not need to mind my hygiene for the next two months .
17632200	loss	mind	11	11	9	9	I consider was a big loss to Ireland never mind the loss of their heritage for the people involved .
17634919	business	mind	18	18	15	15	I cooled off lunch time but later Sarek caused unnecessary conflict when he should just mind his own business .
17663120	correspondence	mind	11	11	10	10	I am not watching this page , but do not mind correspondence relating to this .
17682404	company	mind	14	14	12	12	I am doing a metric ton of these , and would not mind some company .
17685020	top	mind	22	22	19	19	I am fairly confident that this is not what your looking for , but its all that comes to mind off the top of my mind .
17702302	article	mind	8	8	6	6	I am sure he would not mind the article with references to his pages , but English is not my first language .
17736060	use	mind	10	10	8	8	I also believe that the company would not mind the use of its picture in an article , because it helps promote it .
17739565	humor	mind	9	9	4	4	I also do not mind a bit of gentle humor in my talk either .
17760847	need	mind	7	7	4	4	I am bringing to mind the possible need for a -1 when performing any multiplication , and wonder how it relates to the trick to obtain a talyor series expansion of log .
17763506	check	mind	7	7	4	4	I also would not mind a second check .
17773652	business	mind	12	12	9	9	I am alone , and I should probably just mind my own business now .
17807537	one	mind	13	13	11	11	If that opt-in list -LRB- or cat , I do not mind which one -RRB- would increase to more than let ' s say 500 people , then the bot could still be changed to the opt-out procedure .
17813249	collapse	mind	20	20	18	18	If the answers slide too deep into the territory of either of the above , I do not mind a collapse of the question .
17892156	way	mind	28	28	26	26	If possible , leave this open , but feel free to remove it from the main BRfA page if you want -LRB- although I do not mind either way -RRB- , as I feel closing it and having to start all over again might be more problematic than waiting upon seeing what the consensus is .
17930688	disclaimer	mind	35	35	33	33	I ' d argue that even that disclaimer is unnecessary , beccause it ' s implicit in the nature of an encyclopedia , but that ' s another argument and I do not mind the disclaimer because it ' s linked form every page without being thrust bodily into the articles to distract from content and distort the structure of articles , as our spoiler warnings do .
17944437	business	mind	20	20	17	17	I believe this also qualifies me to ask , out of my own vanity , that people mind their own business .
18051907	straddle	mind	8	8	4	4	I certainly would not mind a long naked straddle from many of the women I know .
18070659	rest	mind	6	6	4	4	However , I do mind the rest of your unhelpful and unconstructive first comment .
18085426	business	mind	20	20	17	17	I admit I have made some borderline contribs here , but for the most part , I mind my own business .
18086598	sockmaster	mind	25	25	30	30	I admit that the evidence may appear quite weak , but really smells a lot like a long-term abuser , and this is the first sockmaster who I have in mind .
18099273	expansion	mind	40	40	34	34	However , if you just want the billionth digit without having to compute all the preceding ones , there is a beautiful spigot algorithm for obtaining it , at least if you do not mind a hexadecimal rather than decimal expansion .
18110619	business	mind	16	16	13	13	I absolutely HATE all forms of thought police and think you clowns should mind your own business , express your own thoughts in your own ways and leave others alone to express their thoughts freely .
18259620	thread	mind	12	12	10	10	As my question has been answered , I would not mind this thread being closed .
18266757	loosening	mind	30	30	28	28	As I ' ve said , I think we err often in deleting images based upon purely notional concerns concerning their copyright status , and I would not mind some loosening of some of our guidelines with respect to these .
18267660	objective	mind	10	10	15	15	As I wrote above , NPOV is the very last objective that L6W has in mind .
18274437	score	mind	7	7	4	4	Asked if he would mind this original score going into the archives of the Province , Fr .
18274776	player	mind	16	16	13	13	Asked to sing , Karen performed for Osborn , who said `` Never mind the trumpet player ; this chubby little girl can sing .
18364100	business	mind	41	41	38	38	At any rate , in the last 24 hours , I ' ve received 4 e-mails of varying levels of offensiveness from this user -LRB- sent via Wikipedia ' s interface -RRB- , ranging from demanding that I mind my own business , to saying in very clear terms that he intends to edit war endlessly to keep the content in the article , to simply calling me a `` DOUCHEBAG '' .
18401398	station	mind	20	20	18	18	At a first glance the unattuned observer would hardly realise that there had been a railway , never mind a station on the site of Goathland ' s first station .
18440800	control	mind	21	21	20	20	Apparent POV fork of brain-computer interface , most recently cleaned up after being loaded down with conspiracy theories identical to mind control .
18500017	paradox	mind	24	24	20	20	Appears to be completely unknown , at least under this name -LRB- which I assume was chosen to call to mind Russell ' s paradox -RRB- .
18523282	business	mind	38	38	35	35	A platelayer ' s wife from a nearby cottage asserted to the contrary , that she had spoken to women in the forward carriages , urging them to get out , and been told to mind her own business .
18623560	drop	mind	19	19	16	16	A state of the art 4D cinema may be a good alternative if you do not mind the sudden drop in temperature to minus 12 degrees Celsius inside Snow World , which is just around the corner .
18648667	page	mind	10	10	8	8	As Phil has suggested , he does not mind the page existing either .
18717400	abuse	mind	36	36	33	33	As the explanations for SRA were distanced from evangelical Christianity and into the realm of `` survivor '' groups , the motivations ascribed to purported Satanists shifted from combating a religious nemesis to mind control and abuse as an end to itself .
18732892	story	mind	16	16	13	13	As the narrator looks out the windowpane , an old story comes to mind ; a story of the house that the narrator is living in .
