sentence_id	n	v	n_first_index	n_last_index	v_first_index	v_last_index	sentence_text
33754847	father	hates	8	8	5	5	It is shown that he hates his Israeli father as Eli David arranged for the attack on Gaza on a day when Ari was in the city .
33771362	anyone	hate	22	22	21	21	It is the duty of the Sikh to take on qualities of this nature and to easily forgive ; to never hate anyone ; to live in His Hukam - `` Will '' and to practise compassion and humility .
33771363	anyone	hate	22	22	21	21	It is the duty of the Sikh to take on qualities of this nature and to easily forgive ; to never hate anyone ; to live in His Hukam -LRB- `` Will '' -RRB- and to practise compassion and humility .
33775005	template	hate	13	13	11	11	It honestly looks like the owrk of about 5 people who hate the template , but I neither agree with them nor think their reasoning is sound .
33852990	page	hate	7	7	5	5	It is likely if you hate this page , you need it .
33875681	sort	hated	4	4	10	10	It is just the sort of didactic plod that Coward hated when others were writing ; and with good reason .
33953654	Jazz	Hates	27	27	26	26	It essentially picked up where WXB 102 left off , debuting several late 1980s New Wave acts such as INXS , When In Rome , Johnny Hates Jazz , Red Flag , Camouflage , The Sisters of Mercy and Information Society .
33954342	speech	hate	28	28	27	27	It establishes penalty in the form of fees or imprisonment for up to two years for publication or distribution of materials which contain defamations , threats , hate speech or offenses for LGBT people .
33961154	being	hate	26	26	22	22	It explores the opposing desires for vengeance and forgiveness in this extreme situation , and the commitment required to love or to hate a fellow human being .
33988376	job	hates	10	10	8	8	It follows Anthea , a 25-year-old girl who hates her job and has to sit back and watch as all her friends move away from her hometown , Brisbane , to make a better life .
34026267	man	hating	11	11	10	10	It featured a devil-may-care character , a peaceful , violence hating man who attracted trouble wherever he went .
34151560	injustice	hate	11	11	10	10	It is the first duty of an American citizen to hate injustice in all its forms .
34151561	injustice	hate	11	11	10	10	It is the first duty of an American citizen to hate injustice in all its forms ; then he we be prepared to do justly , love mercy , and walk as he ought to walk in the sight walk in the sight of God and Man .
34164582	magic	hates	9	9	8	8	It has been mentioned several times that Theresa hates magic .
34172710	television	hated	7	7	6	6	It has been reported that he hated television and never owned a set at all .
34175242	king	hated	10	10	6	6	It has been said that villagers hated Alastairo and the king and plotted to kill them .
34175280	em	hate	14	14	12	12	It has been said that `` you love ' em or you hate ' em '' .
34178497	killer	hated	30	30	24	24	It has been suggested by Ray Rimell that the reason for this confusion was a calculation by the authorities that the downing of a hated and feared Zeppelin ' baby killer ' , would play better with the public than the destruction of an almost unknown Sch u tte-Lanz type .
34179521	speech	hate	20	20	19	19	It has been suggested that his access to his original account be restored and that the comment regarding `` hate speech '' be expunged from the block log of Giano .
34230884	suggestion	hate	10	10	8	8	It is a bit radial and you might hate the suggestion -LRB- make sure you consult any other regular editors before making such a change -RRB- .
34330386	enemy	hate	19	19	17	17	It is believed that Tokikuni ' s last words to his son were , `` Do not hate the enemy but become a monk and pray for me and for your deliverance .
34347401	spam	hate	16	16	15	15	It is constantly being bombarded with unidentified sources , uncredible sources , inflammatory messages , hate spam , unchecked facts , etc .
34447114	wikipedia	hating	34	34	33	33	It is always sad when an editor leaves , especially when one who has put so much in , but if they push through the demoralised zone , they ' ll end up hating wikipedia , and that ' s not good .
34455935	news	hate	27	27	23	23	It is a multi-media news agency , as well as a print news organization , reporting on topics ranging from financial markets to hate crimes and political news .
34512948	Wit	hated	11	11	9	9	It is also revealed at this time why Burrich hated the Wit so much , as he tells the history of his witted grandfather to Fitz .
34513889	serfdom	hated	7	7	6	6	It is also said that he hated serfdom at heart and would have liked to destroy it , as well as detesting the tyranny of the Baltic squires over their `` emancipated '' peasantry .
34535610	mechanic	hated	10	10	13	13	Leaving school at thirteen , Isherwood became an apprentice motor mechanic which he hated .
34542027	site	hate	9	9	7	7	Leeds side that were surely beginning to hate the site of , Shankly must have been overjoyed at the fact that Everton finished a full 20 points adrift of his beloved Liverpool .
34587043	information	hate	2	2	1	1	Leftists hate information that contradicts their own poorly held views .
34604540	speech	hate	24	24	23	23	I read the exchange , and saying that someone ' s actions show them to be a practicing bigot does not amount to hate speech or even an insult .
34606670	section	hate	6	6	4	4	I realise some editors hate this section , but I hate piling on with opposes to RFAs that are obviously going to fail .
34610324	type	hates	6	6	4	4	I realize the nominator hates this type of article with a passion , but it really would be better to grit teeth and move along if sources are showing .
34614811	intent	hate	4	4	2	2	I really hate an intent to defraud .
34614818	campaigning	hate	3	3	2	2	I really hate campaigning , especially negative , especially offwiki .
34614827	thought	hate	5	5	2	2	I really hate even the thought of it , but has anyone considered just contacting his ISP , which is Comcast Cable in Boston .
34614862	mindset	hate	5	5	2	2	I really hate the deletionist mindset of too many on Wikipedia .
34614863	information	hate	6	6	2	2	I really hate the extremely detailed information of the Thriller 25 section .
34614864	fact	hate	4	4	2	2	I really hate the fact that I have to spend my time to write such a report and respond to all these miserable attacks .
34614866	map	hate	4	4	2	2	I really hate the map , IMHO it should be deleted and a better one should be found -LRB- along with proper sources -RRB- .
34614868	policy	hate	5	5	2	2	I really hate the notability policy .
34614869	owner	hate	8	8	2	2	I really hate the original EssjayBot and its owner , but I love the new EssjayBot II and its owner !
34614870	focus	hate	5	5	2	2	I really hate the overt focus on human health .
34614875	scene	hate	5	5	2	2	I really hate the word scene because it denotes and encourages fake acting .
34614877	argument	hate	4	4	2	2	I really hate this argument but Eskimo Bob actually had a fairly large internet following .
34614878	kind	hate	4	4	2	2	I really hate this kind of shit .
34614879	system	hate	5	5	2	2	I really hate this new system .
34616880	work	hate	7	7	3	3	I really really hate tedious , mindless work such as this .
34616881	way	hate	6	6	4	4	I really , really hate the way some people pounce on brand new articles , tagging them for speedy deletion just minutes after their creation .
34618378	music	hate	8	8	7	7	I really , truly , unearthly , hate music or sounds from browsers .
34622307	mail	hate	8	8	7	7	I received unbelievable amounts of threats and hate mail .
34649636	group	hating	10	10	7	7	I reject profoundly being accused of `` hating every other group than Germanic peoples '' , along with all the other accusation .
34659006	cover	hating	5	5	3	3	I remember Roadrunner hating the cover , saying there was too much going on and nothing to focus on .
34660852	product	hated	50	50	47	47	I remember watching American Chopper quite regularly , because I enjoyed seeing the construction of the bikes in action -LRB- did not care all that much for all the make believe drama , but hey -RRB- , and while the process was fascinating , I almost always hated the finished product - the bikes were -LRB- to me -RRB- just plain tacky and really cheap looking with all the unnecessary bells and whistles .
34681681	history	hated	10	10	9	9	I say this as an historian , one who hated history before college .
34681736	inflation	hates	20	20	17	17	I say this as someone who has done a lot of grading at Harvard , and really hates the grade inflation there .
34684639	recording	hated	14	14	13	13	Ironically , `` Boys to Men '' , the song that Johnny Gill hated recording , ended up becoming the name of the group who changed their name to Boyz II Men .
34684861	voice	hates	5	5	3	3	Ironically , Crypto hates his voice , even though he sounds very similar .
34685872	faction	hated	9	9	13	13	Ironically , his actions helped bring T o seiha faction , which he hated , absolute control over the Japanese Military .
34690607	name	hated	29	29	26	26	Ironically , when I started to use Wikipedia regularly , I created a few names and made false starts to become a contributor , because I hated the anonymous name I created .
34702589	sister	hate	5	5	3	3	Iris not to hate her sister .
34711222	pair	hated	7	7	2	2	Isabella really hated this father and son pair , who were special favorites of Edward II .
34716848	SHOW	hate	21	21	19	19	I said nothing about bad faith until the post immediately above , and I have not ever insisted you hate THE SHOW .
34720194	creationism	hate	8	8	7	7	Irony To all of you darwinists who hate creationism and would love nothing more than to delete this article .
34760146	officer	hate	39	39	43	43	It would be nice if Durin and his allies admitted that there is at least a slight slimmer of possibility that I am in fact a different person and stop posting that I am alternate personality for this naval officer which you apparently hate .
34766291	speech	hate	9	9	8	8	It would be very easy to find `` hate speech '' in the writings of some feminists -LRB- -LSB- -LSB- Valerie Solanas -RSB- -RSB- and -LSB- -LSB- Andrea Dworkin -RSB- -RSB- come to mind -RRB- .
34778106	A7	hate	10	10	9	9	It would probably be speedy under A7 but I hate A7 .
34783997	argument	hate	5	5	2	2	I typically hate the cruft argument , but man , this is pushing the boundaries .
34784076	idea	hate	13	13	11	11	I typically would not list this third bunch - - I hate the idea of getting a false positive , here - - but it looks a little bit like somebody trying to autoconfirm some more accounts .
34794638	name	hated	7	7	4	4	I ' ve always hated my last name .
34794639	convention	hated	6	6	4	4	I ' ve always hated the convention of shooting on a street , and then having to stop the traffic , and then having to tell the actors , ' Well , there ' s meant to be traffic here , so you ' re going to have to shout .
34802356	philosophy	hate	4	4	3	3	I used to hate philosophy , I thought it was all garbage .
34802359	rain	hate	5	5	3	3	I used to hate the rain .
34802464	color	hate	23	23	21	21	I used to have a to-do list that was based on the template , but I stopped using it because I hate the color of the background -LRB- ugh , tangerine -RRB- .
34802705	man	hated	30	30	28	28	I used to like his shows , but after they killed and deer and skinned it for no purpose other than killing a deer and skinning it I hated the man .
34807159	editing	hate	5	5	2	2	I usually hate the excessive editing that goes on around here to alter really minor points about an image , but this edit improved the focus a lot and the image itself is striking and illustrative .
34807617	someone	hate	8	8	7	7	I usually say that you can not hate someone unless you love them .
34812678	job	hates	13	13	11	11	It will star Greg Davies as Dan , a man who hates his job as a teacher , and Rik Mayall as his father .
34830400	system	hate	9	9	6	6	Ivy Goh Nair , I indeed hate the caste system very much -LRB- I ' m neither Dalit nor Brahmin - - I am anti-caste person -RRB- .
34841416	name	hated	18	18	15	15	It was the friendly nature of the Fuzzies that got on their nerves and they hated the new name of the island .
34864089	playing	hated	17	17	16	16	It was this use of advanced overdubbing that was the main motivation for Zappa , who hated playing in a studio .
34891375	List	hate	7	7	4	4	List of people who hate Sarah Palin List would be so long that it will crash the internet .
34907932	everyone	hates	8	8	7	7	Louie will kill you at everything and hates everyone .
34912278	wordage	hate	39	39	37	37	Louis Armstrong has always been regarded - - let me be as kind as I possibly can ; I think Louis Armstrong first of all is a great talent - - great , as much as I hate the wordage , a great credit to his race , but he has also been regarded by his race as a man who .
34928682	band	hated	6	6	4	4	Louis music journalist that hated the band .
34966520	smell	hated	15	15	12	12	Lopez visited his father ' s workplace as a child and `` hated '' the smell of tobacco that permeated the factory building and his father ' s clothing when he returned home form work .
34969679	church	hated	6	6	4	4	Lord Asriel , who hated the church , arrived one day and took Lyra to his alma mater , Jordan College , where she was placed in the care of the Master .
34975586	sin	hate	6	6	5	5	Lord , help us to hate sin and love you more .
35013882	plaid	hates	11	11	10	10	London loves fashion ; she only wears designer clothes and hates plaid , especially the plaid Catholic school uniforms .
35052766	slavery	hated	2	2	1	1	Lincoln hated slavery , and was willing to say so very publicly on a number of occasions from 1837 on , which strongly differentiates him from Thomas Jefferson .
35054689	slavery	hated	28	28	27	27	Lincoln shared the prejudices of his white fellow-countrymen against the Negro , it is hardly necessary to say that in his heart of hearts he loathed and hated slavery .
35058615	step-mother	hates	8	8	6	6	Linda Marshall -LRB- aged 16 -RRB- hates her step-mother .
35108308	party	hated	9	9	6	6	Lockhart was a Jacobite , who hated the pro-Union party because of their support for the Revolution of 1688 .
35172144	music	hates	10	10	8	8	Lewis has been criticized as an extremist who hates secular music of any kind and misrepresents the Hip-hop culture .
35206819	book	hated	3	3	1	1	Lehmann hated this book for he felt Jonathan had taken liberty to fluff it up a bit .
35212818	roll	hate	9	9	6	6	Leigh exclaims `` God , I hate rock and roll .
35243836	persona	hates	56	56	53	53	Lex -LRB- still on the run -RRB- had given Superman -LRB- through Clark -RRB- a new more powerful costume with a red on yellow `` S '' crest , FDR has called for Superman to have a `` chat '' -LRB- to which Clark is reluctant to attend -RRB- , and sometimes Clark hates his Superman persona because of the pressures put upon him and also because Lois dislikes Clark but loves Superman .
35254582	guy	hating	31	31	30	30	Liam gives a new perspective to Gale ' s appearance , while he played the role perfectly , he showed Gale as the serious , fun-loving , caring , Capitol hating guy he is while not making him too much of a jerk .
35303552	film	hated	4	4	2	2	Kennedy emphatically hated the film and Warner Bros .
35310318	war	hated	12	12	9	9	King Louis VII was a man of peace who hated violence and war but the attacks on Toulouse made clear that peace with Henry II was not peace at all but just the opportunity to make war elsewhere .
35315058	brother	hated	4	4	2	2	King Peter hated his brother and all the others under John ' s command because of their incompetence and how they handled the attack of Godfrey .
35317631	attention	hated	37	37	34	34	KMFDM frontman and founder Sascha Konietzko had described Nihil as `` the crown '' , and said the band had come as close to mainstream popularity as he wanted , and that he `` hated all the attention , interviews , photo shoots , etc .
35320812	music	hated	2	2	1	1	Kneale hated music off disc so the score was conducted live to the performance by Hotchkis from Lime Grove Studio E , next door to where the play was being staged , with Hotchkis and his orchestra following the action on a closed-circuit screen to synchronise their performance .
35322740	life	hating	16	16	14	14	Knife is shown to be at odds with his role in the series , hating his life because of how he is used .
35323669	hierarchy	hated	10	10	7	7	Knight did not like authority and he hated the social hierarchy of the army which allowed people only a few months older than him to boss him around as they were second year and he was first .
35352773	life	hates	19	19	17	17	Kitty53 has twice posted to my talk page that she wishes she were dead and that she hates her life in response to my nominating three of her voice actor articles for deletion .
35361614	father	hated	10	10	14	14	Klarth is worried about becoming too much like his own father , whom he hated for being too involved in research to spend time with family , and Milard comforts him .
35362992	script	hated	11	11	9	9	Klaus Kinski turned down the role , as he hated the script .
35370978	name	hated	3	3	1	1	Kline hated the name , but the others decided Kline would have no say in the matter .
35376845	addition	hate	28	28	26	26	Mac , and while I do not mind the Mac-like UI for the browser shell -LRB- the address bar shape and such -RRB- I hate hate hate the addition of a Mac-like UI in the web-pages themselves -LRB- all form buttons being rounded , in particular -RRB- .
35408153	capitalism	hates	5	5	1	1	Luke hates the government , capitalism and even his own mother .
35411505	heat	hate	14	14	13	13	Luke then discovers that , while the aliens love the cold , they hate heat .
35412397	man	hated	14	14	12	12	Lydia ' s backstory states that she loved her daughter June but hated the man she married , Frank , so she grew old alone .
35426310	chart-topper	hated	18	18	15	15	Macgregor admitted in The Billboard Book of Number One Hits by Fred Bronson that she hated her own chart-topper , chiefly because she had little sympathy for the narrator of `` Torn Between Two Lovers '' , a woman who confesses to her husband that she is having an affair , but pleads with her husband to stay with her and accept the situation .
35427774	nickname	hates	9	9	1	1	Mac hates the name as well as his old nickname , `` Ronnie the Rat , '' which he obtained from ratting on fellow drug dealers in high school .
35432378	PC	hate	4	4	3	3	Mac if you hate PC ' s so much '' -LRB- and no , technically a Commodore is not a PC , PC refers to IBM Clones and a Commodore is not , just like Apple but of course if you disagree take it to your own talk page not here and not mine -RRB- .
35449504	G	Hates	21	21	19	19	Made in America '' is parodied in the series finale of the sitcom Everybody Hates Chris , `` Everybody Hates the G .
35457325	lover	hates	16	16	10	10	Madido , a drunkard , Stupido , a puritan who hates learning , Amoretto , a lover , and Ingenioso , a disappointed student .
35464133	title	hates	10	10	8	8	Madonna has commented in various interviews that she hates the title of In Bed with Madonna and has described it as `` stupid '' .
35492013	brotherhood	hated	4	4	2	2	Ma Anliang hated Muslim brotherhood , which he banned earlier , and sentenced all its members to death , and wanted to personally execute Ma Wanfu because he was its leader .
35508806	Gastroturfing	hate	4	4	3	3	Look , I hate Gastroturfing as much as anybody , but I think we should stick to facts and stop looking for reds under the bed , as it were .
35508807	idea	hate	5	5	3	3	Look , I hate the idea of using a decades-old Times article but the Times is reliable per the standards .
35515255	cheese	hate	15	15	14	14	Lots of people think that mullets are ridiculous or despicable ; lots of people hate cheese ; lots of people think frogs are slimy and disgusting ; and so forth .
35532605	stuff	hate	6	6	2	2	Lordy I hate this new vector stuff .
35533241	reference	hate	23	23	21	21	Loremaster made 4 reverts in less than 90 minutes , all in an effort to include a top 10 reasons to hate Oprah reference in an article about her magazine .
35533353	poverty	hated	23	23	21	21	Lorena dreams of starting her own family and loves to cook , while Sara is more materialistic ; she has always hated the poverty of the orphanage , and she has more ambitions than values .
35538242	idea	hated	3	3	1	1	Lorimar hated the idea , and it nearly led to Ashby being fired from the picture ; but Ashby prevailed , and his ending is now regarded as a brilliant mock-allegorical coda .
35590718	school	hates	5	5	4	4	Like Todd , Buzz hates school , and he has a habit of cheating .
35596577	Lion-O	hate	20	20	19	19	Losing both the right to succeed his foster father and the only mother he knew , Tygra grew to hate Lion-O and questioning the latter ' s decisions after he became the new Lord of the ThunderCats .
35600448	land	hate	16	16	13	13	Loss of his best friend Reyaz , and violence around coerces Ruslaan to hate his own land .
35602411	show	hate	13	13	11	11	Lost , had heaps of friends who loved it but I hate the show .
35610896	job	hating	5	5	3	3	Lois ends up hating the job and wants to quit but Peter tells her not to give up so soon .
35730253	radio	hate	4	4	2	2	Mainstream broadcasters hate pirate radio because the upstarts get to break all the rules , including not having to pay the Federal Communications Commission for licensing .
35744940	community	hates	6	6	4	4	Likewise , if Kumioko hates the community unfortunately he is not going to be able to help fix what ever problems may exist -LRB- imagine electing a president who hated your country !
35809013	role	hates	3	3	1	1	Lisa hates her role as a homemaker and , realizing that her future dreams have been shattered , loses interest in being a good student .
35811037	music	hates	6	6	4	4	Lisa ' s dad hates the music Henry listens to and did not agree with her marrying William .
35825834	job	hates	10	10	8	8	Lloyd was portrayed as a big loser who hates his job .
35850628	speech	hate	8	8	7	7	Liz Smith comments on Hilton ' s hate speech .
35860967	job	hated	22	22	20	20	He was revealed to be Kaito ' s older brother , whom Kaito thought had simply run away because he hated his job .
35896850	brother	hates	11	11	9	9	He who says he is in the light and hates his brother is in the darkness still .
35925793	way	hated	5	5	3	3	He would have hated the way I end this piece .
36002577	occupation	hated	25	25	23	23	He was raised to be a farmer and hunter in a village unkwown to us currently , at an age of 17 he hated his occupation .
36065000	series	hate	23	23	19	19	His reviews tend to lean towards FMV games and bad Final Fantasy games -LRB- he has often claimed to hate the Final Fantasy series in general -RRB- as well as a retrospective on the entire Ultima series , starting as a tribute of the good earlier games working its way to the horrible later games .
36078963	brother	hating	19	19	17	17	His parents insist they were trying to do the right thing and protect him from growing up hating his brother , but Paul persists and says that instead of hating his brother , he ' s been hating himself all along .
36078963	brother	hating	31	31	29	29	His parents insist they were trying to do the right thing and protect him from growing up hating his brother , but Paul persists and says that instead of hating his brother , he ' s been hating himself all along .
36084271	anyone	hate	9	9	8	8	His parting message to them was never to hate anyone , as he had abandoned any hatred for people while he was in jail .
36099555	job	hate	27	27	25	25	His older brother Johan-Friso would arguably be more entitled to it , but statements he has made in the past strongly suggest that he would hate the job .
36103354	puppet	hate	10	10	6	6	His only line is `` I hate that little wooden puppet '' .
36126476	life	hated	10	10	7	7	He was sent to Boarding school but hated the restrictive life there .
36130713	Lync	hate	5	5	4	4	He was shown to hate Lync because of his cheekiness .
36139479	democracy	hate	17	17	14	14	He was very impressed by the First World War , which led him to hate patriotism and democracy .
36159257	administration	hated	10	10	8	8	He was not a natural teacher , and hated university administration .
36223906	movie	hate	13	13	11	11	He was reportedly told by his publicist , `` Because they hate the movie , Michael .
36226543	Music	Hate	13	13	11	11	He was responsible for the album Classical Music for People Who Hate Classical Music in 1953 .
36301164	brother	hate	23	23	19	19	Hong is moved by her actions , and his siblings all like her , but they still continue to hate her father and brother .
36329503	article	hate	15	15	12	12	Homeopathy advocates are making extensive use of social media , they seriously hate the Wikipedia article because it is accurate and unbiased .
36333050	neighborhood	hate	6	6	4	4	Homer responds `` I hate this neighborhood '' .
36333707	smell	hate	18	18	16	16	Homer tells Moe , who keeps his wallet in his shoe , `` I used to hate the smell of your sweaty feet .
36346783	school	hated	20	20	19	19	Holden addresses Carl as an `` intellectual guy '' and asks him hypothetically what he would do if he hated school and wanted to `` get the hell out of New York .
36355076	someone	hating	11	11	10	10	His transformations will be triggered when he is angry or hating someone -LRB- with the full moon -RRB- .
36377485	speech	hate	25	25	24	24	His user page , his talk page , his edits , his edit summaries are all chock full of abuse , obscenity , and hate speech towards Muslims .
36410883	idea	hate	6	6	4	4	His wife and kids hate the idea .
36413985	practice	hates	6	6	2	2	His wife hates the thought and practice of normal sexuality in their marriage .
36421348	uncle	hating	3	3	2	2	His woman hating uncle , however , Fire chief Amos McCarthy -LRB- Dent -RRB- , tells his nephew to avoid marriage because all women want is money .
