sentence_id	n	v	n_first_index	n_last_index	v_first_index	v_last_index	sentence_text
16688246	life	hating	30	30	28	28	It is revealed that the woman is in fact Jenny Quantum ' s twin sister , Jenny Fractal , raised by Chinese authorities into a killing machine , hating all life and Quantum in particular , and that she is the one responsible for the Bleed fractures .
16693686	job	hated	8	8	6	6	It is quite possible that he hated the job so much , he quit after just one game or was actually a spectator who volunteered to be an umpire for whatever reason -LRB- I doubt baseball rules were as strict and complicated back then as they are today -RRB- .
16708465	song	hated	7	7	5	5	It is said that Owen hated the song so much he quit the music business .
16761772	violence	hates	8	8	7	7	It is stated by Ezekiel that Shiva hates violence as she reacted angrily to Rick punching Dwight .
16800486	vanity	hates	4	4	3	3	Delete , we hates vanity we do .
16809006	cruft	hate	5	5	2	2	Deletify I hate the word cruft .
16815456	plagiarism	hate	3	3	2	2	Delete I hate plagiarism , and I think there should be zero tolerance for it .
16838931	site	Hates	13	13	11	11	Delete this article , but put a link to the God Hates Shrimp site in the Westboro Baptist Church article .
16853727	guy	hate	7	7	5	5	Delete As much as I hate the guy for running Australia like a shonky business for the past 11 and a half years , having an article like this is a bit unfair to the bloke .
16853728	format	hate	10	10	5	5	Delete As much as I hate the user conduct RFC format , its certainly better than this .
16865008	freedom	hate	4	4	3	3	Delete because I hate freedom lacks enough independent reliable sources for its own article ; mention the org at David Horowitz per Inkpaduta above .
16904442	person	hate	6	6	4	4	Delete So many people hate this person that a fair article free of BLP violations is impossible .
16917120	vernacular	hate	7	7	4	4	Delete Oh how I hate black english vernacular .
16929204	twitter	hate	12	12	11	11	Delete Per lack of sources and the fact that I passionately hate twitter and see any attempt to use it as a source as an issue affecting the very credibility of the project as a whole .
16932751	type	hates	10	10	8	8	Delete per nomination , seems like someone really hates this type of women .
16964649	place	hates	15	15	13	13	Delia asks her how is everything at the store and Melinda answers she hates the place and she never wants to go there again .
16983555	work	hate	14	14	18	18	I agree to a point that these articles will require a massive amount of work , what I hate about the general response given here is the snippy comments that we should somehow be heartily ashamed of outsevles for trying to start the prcess of transferring notable articles into English .
16994519	bot	hate	13	13	11	11	I am not lying , I am not posting because I hate the bot .
16997851	nationality	hate	7	7	5	5	I am not scared or hate any nationality .
17013777	format	HATE	13	13	5	5	I ask this because I HATE the `` December 25 , 1999 '' format .
17020672	literature	hate	19	19	18	18	I believe his entry should be kept primarily because his ministry is a notable source of conspiratorial and hate literature , and he himself is well known in conspiracy theory circles .
17037189	thing	hate	12	12	8	8	I am moving to strong oppose as I hate the whole IRC thing too and I dislike badgering of good-faith opposes .
17038929	naming	hate	13	13	10	10	I am no expert on Chinese history -LRB- and I hate unpronounceable Pinyin naming -RRB- .
17053105	case	HATE	23	23	20	20	I ca not locate any current SSP case against Libr0 to merit the tag nor can I find the I HATE CAPTCHAS SSP case that existed previously .
17074885	style	hates	7	7	5	5	I can , Sue Anne hates the style of my edits .
17080183	baseball	hate	3	3	2	2	I can hate baseball without hating a baseball player , or rap music without attacking a rap musician .
17080183	player	hating	8	8	5	5	I can hate baseball without hating a baseball player , or rap music without attacking a rap musician .
17082817	capitalism	hate	6	6	5	5	I can love Germany and hate capitalism .
17117160	everyone	hate	6	6	5	5	I can confirm that I hate everyone .
17125710	speech	hate	30	30	29	29	I do not believe , and I would like to see any evidence to the contrary , that this was ever included as a prohibition against removing links to hate speech , especially hate speech against our editors for - in the main - enforcing policy .
17125710	speech	hate	34	34	33	33	I do not believe , and I would like to see any evidence to the contrary , that this was ever included as a prohibition against removing links to hate speech , especially hate speech against our editors for - in the main - enforcing policy .
17130114	state	hate	7	7	4	4	I do not even hate the Zionist state for all the damage it has done to my people ; the Palestinians .
17131420	MJ	hate	4	4	3	3	I do not hate MJ I believe an article should be about the subject .
17131424	claim	hate	6	6	3	3	I do not hate the Peruvian claim , and your continued accusations show that there is no sincerity at all in your so called peace offer .
17131425	state	hate	5	5	3	3	I do not hate the state .
17131426	genre	hate	8	8	3	3	I do not hate the term or the genre .
17134610	speech	hate	10	10	9	9	I do not know if the SPLC defines `` hate speech '' .
17137204	topic	hate	6	6	4	4	I do not necessarily hate the topic .
17152074	everybody	hate	15	15	14	14	I do not care what religion or lack thereof you follow , I just hate everybody and have a strong desire to crush your work for stupid reasons like not following the site ' s arbitrary guidelines , that I totally make up just to mess with you .
17152921	RFAR	hate	9	9	8	8	I do not do this lightly -LRB- I hate RFAR -RRB- however I feel it ' s the only way forward in this situation , and in the best interests of the community , as the general sanctions these articles are under have been ineffective .
17155376	anything	hate	6	6	3	3	I do not hate Muslims or anything .
17155378	poetry	hate	4	4	3	3	I do not hate poetry , but encyclopedias are supposed to be written prose .
17155380	transparency	hate	5	5	3	3	I do not hate the transparency of BISE in the slightest , I love it , because it exposes your motivation and your edits to scrutiny , I just hate the fact that people who have a clue about NPOV never go there and see the garbage edits it produces , or correct the other people who have no idea what they are doing wrt policy either , or do not realise that that page is not a community effort at all and are conned into participating because they think they have to .
17155380	fact	hate	31	31	29	29	I do not hate the transparency of BISE in the slightest , I love it , because it exposes your motivation and your edits to scrutiny , I just hate the fact that people who have a clue about NPOV never go there and see the garbage edits it produces , or correct the other people who have no idea what they are doing wrt policy either , or do not realise that that page is not a community effort at all and are conned into participating because they think they have to .
17165251	everyone	hating	18	18	17	17	I did not become a terrorist , but I can say that without knowing , I started hating everyone who was not a Muslim .
17172157	drama	hate	15	15	13	13	I do not like policy for the sake of policy , but I hate unnecessary drama , and allowing AfDs like this to be closed early , especially by an involved party , only creates a ton of drama .
17172215	stuff	hate	12	12	9	9	I do not like sword and sorcery , I hate all that stuff '' .
17175080	history	hate	11	11	9	9	I do not really care about Napoleon and I hate battle history .
17203967	genre	hate	11	11	9	9	I did not write the article and I truly hate the genre but I realize the subject matter is notable enough to remain on Wikipedia and thus I say keep the article .
17237103	anyone	hates	5	5	4	4	I doubt anyone here hates anyone .
17259843	GAs	hate	8	8	5	5	I do agree , I hate rubber stamp GAs when a set of critical eyes would have went a long way to improving an article .
17265709	conflict	hate	3	3	2	2	I do hate conflict and I am not the only one !
17265710	deletion	hate	3	3	2	2	I do hate deletion especially when it occurs to a journalist or other notables .
17265941	gmail	hate	32	32	31	31	I do have a gmail address , but I want to use my primary one , because it ' s the one I remember to check the most -LRB- and I hate gmail -RRB- .
17268550	discrimination	hate	5	5	4	4	I do , I hate discrimination against sex and race .
17278283	mail	hate	31	31	30	30	I do not know if I ' d consider the information libelous per se , but the information listed here just seems to perpetuate the amount of death threats and hate mail they get .
17285940	defamation	hate	8	8	7	7	I do not libel anybody , I hate defamation and lies .
17286020	rap	hate	12	12	11	11	I do not like current `` pop songs '' and I hate rap which is becoming more and more prevalent in western societies musical output .
17286164	everything	hate	6	6	5	5	IDONTLIKEIT and clear that you hate everything about this article , there is no changing your mind or reasoning to be had here .
17286299	country	hates	16	16	15	15	IDONTLIKEIT -RSB- -RSB- as well , since he ' s just bitching about how he hates country and derailing an overall decent thread .
17287450	mother	hate	14	14	9	9	If anyone comes to Me , and does not hate his own father and mother and wife and children and brothers and sisters , yes , and even his own life , he can not be My disciple .
17301827	math	hate	24	24	19	19	If he does not like geometry and does not want to study it , you will only make him hate school , teachers and math by forcing him into something he does not wish to do .
17304427	music	hates	4	4	2	2	If he hates trance music and loves house so passioantely , he probably should not be ripping apart years ' worth of accumulated knowledge on the trance music page .
17327461	man	hate	14	14	12	12	I feel , '' says Greenberg , `` that even if I hate a man , I have an honest responsibility to my readers to report what he said and did .
17341745	disgrace	hates	4	4	3	3	If a prince hates disgrace , the best course for him to pursue , is to esteem virtue and honour virtuous scholars , giving the worthiest among them places of dignity , and the able offices of trust .
17366073	school	hate	14	14	10	10	I could think of no quicker way to make students hate English , and school in general , than by forcing them to diagram sentences .
17374363	wife	hates	11	11	9	9	If a man marries , then decides that he hates his wife , he can claim she was not a virgin when they were married .
17389796	tech	hate	35	35	34	34	I feel improperly judged , reading from responses to my post , a `` one issue candidate '' and have been threatened with removal from the site , being a sock-puppet for `` we hate tech '' and accused of `` cluttering '' talk pages .
17393528	work	hate	19	19	17	17	I engage in way to many heated topics , and there is to many people that outright hate my work here .
17394465	wind-chime	hate	34	34	32	32	I enjoy the sound of the wind rushing through the trees , or the pattering of rain , but try though I might to interpret it in the same way , I hate the wind-chime , and that ' s an inconsistent position .
17414891	article	hates	4	4	2	2	If someone hates the article so much they can go edit something no one is looking to read today .
17432697	D	hated	9	9	6	6	If there was anyone that Zapata hated more than D i az and Madero , it was Victoriano Huerta , the bitter , violent alcoholic who had been responsible for many atrocities in southern Mexico while trying to end the rebellion .
17473125	etc	hate	11	11	10	10	If this organization is being accused of indoctrinating people to hate etc , then it should be reported , and that was the initial discussion here .
17476779	idea	hated	19	19	17	17	If this was about something from Scientology , or about Creationism , or something controversial that people hated the idea of , none of you would be voting keep based on the merits of the article .
17491600	band	hate	13	13	11	11	If this is a term being used by elitist fans who hate a band as soon as they sell a bunch of records , I could see it being an article .
17517616	city	hates	5	5	3	3	If the king hates his city , then let him abandon it ; but if me , then let him dismiss me .
17543462	spamming	hate	10	10	8	8	If I am giving the impression that I hate vanity spamming single purpose accounts , then I would have to acknowledge that this is a true and accurate impression .
17551949	music	hate	11	11	9	9	If I had a teacher , then I might hate the music , because I would have been embarrassed to play the dutar for a teacher '' he said .
17553973	chicken	hate	13	13	10	10	If I have no connection to KFC except that I hate their fried chicken , and keep declaring how bad their food is in their article , I have no COI but clearly I ' m editing with a POV .
17554961	Information	hated	6	6	5	5	If I knew Wikipedia admins hated Information so much , I would not even have bothered .
17564978	ass	hating	12	12	7	7	I find myself looking at Blair and hating his self-righteous , Bush-whipped ass the way I only ever hated Thatcher before .
17570102	anyone	hate	14	14	13	13	If it makes either of you feel any better to believe I just hate anyone who reverts vandalism , so be it .
17587038	sin	hates	14	14	13	13	If my understanding of Christian theology is correct , -LRB- a -RRB- Jesus hates sin but loves sinners and -LRB- b -RRB- his crucifixion was necessary for the salvation of mankind , hence the agent of that crucifixion is hardly to be condemned for it , rather they should be honoured .
17601512	term	hate	13	13	11	11	If not , then it is also simply fancruft -LRB- I hate the term , but there it is -RRB- .
17601665	nomination	hate	8	8	5	5	If not then I would hate this overall nomination to close without an inspection to see whether the others have been brought up to standard .
17605752	series	hate	9	9	5	5	I follow troll sites and hate sites and the series the Amazing Racist is quite loved by the hate community .
17607451	Y	hates	23	23	21	21	If one had a huge conflict of interest , for instance , it might be another matter than if editor X hates editor Y , so X goes digging and pulls up info about Y and posts them on-wiki .
17633443	character	hates	26	26	24	24	I contend there are no references to how this character was created and such , that is the question , not how much someone hates the character .
17644632	freedom	hate	5	5	4	4	If Bush says we hate freedom , let him tell us why we did not attack Sweden , for example .
17648655	wikitext	hate	4	4	3	3	If enough people hate wikitext and want to build their own encyclopedia some other way , they can do that .
17650168	idea	hates	6	6	4	4	If everyone else really hates the idea , they can just revert you .
17650317	idea	hate	6	6	4	4	If everyone seems to hate the idea , the old phrase can be substituted back in .
17662173	lack	hate	11	11	9	9	I am not trying to be naive and I hate the lack of knowledge I have because it seems to disadvantage me at every turn with this horrible edit war which has been going on since the 1st day I joined this site .
17662702	anonymity	hate	20	20	19	19	I am not used at all with my current username and finally , in this precise case , I hate anonymity .
17666253	evil	hated	8	8	7	7	I am one who loved good and hated evil , one who was loved in the palace of his lord , one who performed every duty in obedience to the will of his lord .
17667822	speech	hate	5	5	4	4	I am opposed to hate speech and revolutions in general .
17669298	nation	hate	28	28	24	24	I am persuaded that they think to aggravate the title of dog by coupling it with the word French , so much do they hate and despise our nation .
17675443	mayonnaise	hate	16	16	15	15	I am Commnander Salamander on a funny cat-cow that goes `` Moo-meow '' and I hate mayonnaise !
17687172	noise	hate	11	11	9	9	I am from the Uk too and I also hate the noise from Ice cream vans .
17695308	username	hate	19	19	16	16	I am simply retiring my current account and starting a new one , simply because I hate my current username .
17696716	format	hate	8	8	5	5	I am sorry but I hate your new format .
17705216	show	hate	7	7	5	5	I also never said you hate the show .
17722463	linux	hate	25	25	24	24	Iam happy to use `` old '' versions of windows such as XP , 2000 or even 95 because i hate newer versions and hate linux even more .
17722725	way	hating	4	4	2	2	I am hating OttomanReferance way of working , he had in the past a history of using socks to implament his edits , and now had used a cheap tactic to creat two other Armenian casulties pages to justify this article .
17723769	spam	hate	11	11	5	5	I am here because I hate sophistry , fancruft , and spam , of which this is a pure and obvious example .
17743623	war	hated	4	4	2	2	I also hated the war I had with Raul654 on the fact that the World Cup was JUST the world cup and not the `` World Cup Finals '' which I found referred to the final rather than the entire game '' .
17743624	thing	hated	7	7	2	2	I also hated the whole body fascism thing that took over the gays for a long time .
17743627	houston	hate	3	3	2	2	I also hate houston for a host of irrational reasons .
17743637	fact	hate	4	4	2	2	I also hate the fact that it breaks on non-desktop browsers -LRB- i .
17743638	fact	hate	4	4	2	2	I also hate the fact that the sig takes up almost 4 lines of code .
17743639	skin	hate	6	6	2	2	I also hate the new vector skin and immediately went back to monobook .
17743640	way	hate	4	4	2	2	I also hate the way that people think anyone who has ever achieved anything on a bike must have been taking drugs .
17751884	colour	hate	12	12	10	10	I am an Indian guy , obviously brown and I hate my colour because it does not go well with my small eyes and large face .
17761421	voting	hate	9	9	7	7	I also vote Keep because I absolutly hate mass-deletion voting like this .
17764463	hint	hates	8	8	11	11	I always figured that this was just another hint that Jesus hates me .
17764785	page	hated	4	4	2	2	I always hated the page on my own town , because it just looked like a census report , so I think this is a great and incredibly ambitious start .
17804922	everything	hated	18	18	14	14	If that is allowed to happen , Lee Harvey Oswald , a man who hated his country and everything for which it stands , will have triumphed even beyond his intent on that fateful day in November .
17806082	article	hate	24	24	22	22	If that is the case , it will be more appropriate for you then , to stop speaking of merging back to hate group article , every time you counter a keep vote .
17832386	owner	hate	45	45	43	43	If the blacklist is for controlling linkspam , but you discover that some major web site has been hacked , and is hosting malware , you can blacklist it in a flash , even if you have a conflict over that site , hate the owner -LRB- or love him or are employed by him or are employed by a competitor -RRB- , and no matter what the rules say .
17833891	speech	hate	12	12	11	11	If the BSA were using parks to incite violence or spread hate speech , that would be another matter , but as far as I know it does neither .
17904821	wushu	hate	53	53	52	52	If i was a prospective forum member and i wanted to learn about gpforums , and i went to wikipedia , i then learnt all about gpforums , and i saw the notable members aspect , and when i DID join gpforums i would know why people post replies of why they hate wushu , or brock .
17904976	music	hate	27	27	25	25	If I was forced to describe it , which I am , I ' d probably say it was a pop album for people who hate pop music .
17951199	influence	hate	20	20	14	14	I belong to the Left and must work inside it , much as I hate Russian totalitarianism and its poisonous influence in this country .
17966630	school	hating	7	7	5	5	Ian and Linda about Stephen hating the school .
17984111	something	hate	25	25	22	22	I already did that -LRB- on his talk page -RRB- , he declined because he thinks users are going to send him hate mail or something .
18019676	music	hate	9	9	8	8	Ich hasse Musik -LRB- German for `` I hate music '' -RRB- is an album by German heavy metal band Knorkator , released in 2003 .
18029907	everything	hate	22	22	21	21	I definitely look back on that time with fond memories , even though I remember crying and being like ' I hate everything !
18038214	music	hates	51	51	53	53	I despise pseudoscience , but I consider my prejudice against it no reason to remove borderline figures there , andy more than in any other field ; I do consider such attempts expressions of prejudice just as much as it would be to try to preferentially remove articles about musicians whose music one hates , or politicians one disagrees with .
18044091	weather	hates	3	3	1	1	Iceberg hates hot weather , so much so that when he was old enough to enlist in the Army , he signed up and asked for duty in Alaska .
18050340	anyone	hate	7	7	4	4	I certainly do not hate him or anyone else for being a communist any reason .
18069326	design	hated	5	5	3	3	However , IDg hated the design so much that they permanently shelved the final concept .
18074470	mater	hates	15	15	12	12	However , I feel I am being met head-on by someone who hates my alma mater and despises me for being a part of it , therefore he refuses to work with me in the spirit of Wikipedia .
18085246	man	hate	14	14	12	12	I admit , I am not a supporter , in fact I hate the man like no other , mostly because he lied , and lied and lied .
18100486	use	hate	5	5	3	3	However , I hate the use of xxxx-xxxx to note the year for 1999-2000 NHL season .
18110621	character	hated	4	4	2	2	I absolutely hated my character at the end .
18110633	picture	hate	4	4	2	2	I absolutely hate the picture of the dead infant on the hydrocephalus page .
18111335	whitespace	hate	27	27	26	26	I accept , of course , the checkuser results , and I have extended my sincere apologies to Knowledgekid for having incorrectly associated him with I hate whitespace , but I take exception to the rest of your statement .
18115477	film	hated	4	4	2	2	I actually hated this film until watching it after Giuseppe Andrews ' similar work Period Piece .
18238127	holiday	hate	21	21	19	19	As it turns out he was born on December 24 and thus was named Santa , causing him to hate the holiday .
18257700	copy	hate	5	5	4	4	As much as I hate copy and paste arguments , as the nomination is a copy and paste .
18257701	crap	hate	5	5	4	4	As much as I hate crap like aZn pRyD3 lol , this article is absolutely unencyclopedic .
18257702	ballery	hate	6	6	4	4	As much as I hate crystal ballery , I feel like being listed on the same dropdown as LL Cool J , Rihanna , and Method Man -LRB- see -LSB- 2 -RSB- -RRB- makes her notable enough .
18257711	left-alignment	hate	5	5	4	4	As much as I hate left-alignment , I moved it into the lead , and left aligned it .
18257714	rap	hate	5	5	4	4	As much as I hate rap , this article belongs on Wikipedia .
18257719	buildup	hate	6	6	4	4	As much as I hate the buildup of scifi cruft , this one seems like a keeper .
18257720	company	hate	6	6	4	4	As much as I hate the company , that logo is justified fair use .
18257721	Contest	hate	8	8	4	4	As much as I hate the Eurovision Song Contest , there is simply no denying that even such a trivial thing as the selection of an entry is a major media event in every European country .
18257722	idea	hate	6	6	4	4	As much as I hate the idea , a list of school lists by state would be much more maintainable and better present this information .
18257723	idea	hate	6	6	4	4	As much as I hate the idea of a watermarked image , this seems like it would be common sense , especially considering actions shots of athletes are few and far between .
18257724	idea	hate	6	6	4	4	As much as I hate the idea of joining a bandwagon , this editor deserves a bandwagon .
18257725	subject	hate	6	6	4	4	As much as I hate the subject , I have to support a SPEEDY KEEP .
18257726	format	hate	7	7	4	4	As much as I hate the user-conduct-RFC format , its still better than this mess for discussing long-term issues with a user .
18257727	man	hate	6	6	4	4	As much as i hate this man -LRB- as he broke my teeth and nose -RRB- i felt it was only fair to document this two year spree of violence and fist fighting by a man not big not muscle bound just a man who i think either is not scared or just does not care because as evil and dangerous as the man is its amazing to see not just him but other people like this take out in a matter of seconds a group of people or a man mountain .
18257728	state	hate	6	6	4	4	As much as I hate this state , I never want to leave it .
18257729	bastard	hate	7	7	4	4	As much as I hate those limey bastard '' .
18257784	wheel	hate	5	5	4	4	As much as I hate wheel warring , I can understand why someone would unblock -LRB- still a very bad idea , though -RRB- .
18258162	material	hate	7	7	5	5	As much as my detractors hate this material , it must be presented .
18258428	idea	hate	8	8	6	6	As much as you National Socialists hate the idea even FoxNews people have freedom to believe and vote as they wish .
18265281	Sememmon	hates	6	6	5	5	As noted above , he hates Sememmon with a deep passion , as the latter was often Manshoon .
18267722	inclusion	hate	9	9	7	7	As I wrote below , I just hate the inclusion of these generic , useless government condolences .
18293982	song	hate	50	50	46	46	As Monk and Sharona are first investigating the murder of Brad Terry ' s ex-wife Susan Malloy , Marci hands an envelope to Sharona , saying that it ' s a petition to get the old theme song back , since quite a lot of people hate the new theme song of Crime Lab S .
18297859	idea	hates	27	27	25	25	As one of the editors who deleted my contribution said AdrianTM and to whom Prolog readily seconded the reason for eliminating GNU is that he hates the idea of `` Free '' Software and Richard Stallman .
