sentence_id	n	v	n_first_index	n_last_index	v_first_index	v_last_index	sentence_text
52693897	rowdyism	hates	13	13	12	12	Sena has a little brother called Vikram -LRB- Aravind Akash -RRB- who hates rowdyism .
52735411	mate	hates	10	10	7	7	September 2009 -LRB- UTC -RRB- The child hates his school mate , Lewis Hamilton .
52759815	sahuagin	hate	2	2	1	1	Selkies hate sahuagin because of the latter ' s universally aggressive and imperialistic tendencies .
52771688	speech	hate	8	8	7	7	Semitic bias '' - I consider it hate speech and highly offensive to accuse an editor of being racist when there is no evidence of it .
52838294	group	hate	25	25	24	24	Scott Green -RRB- , Peter `` Gooch '' Guccione -LRB- Gaetano Iacono -RRB- and Malcolm -LRB- Constantine Josiah Taylor -RRB- join a radical zombie hate group , run by a ruthless army brat known only as The Commandant -LRB- Christa McNamee -RRB- where they commit several violent acts against zombies .
52879128	way	hate	6	6	4	4	Seconded , though I hate the way it was foisted on us even more , with utterly meaningless and deceptive testing being cited as warranting its implementation .
52881581	Ra	hate	11	11	10	10	Second , if you love 3 Idiots so much and hate Ra .
52888131	everyone	hate	19	19	18	18	Seagull-Descended constitute the fourth most discriminated against group in the UK -LRB- not including Scotlan , who essentially hate everyone -RRB- .
52888145	EP	Hate	12	12	11	11	Seagull , in 2006 and released an EP , called I Hate EP ' s in March 2008 .
52894920	football	hating	4	4	3	3	Sean grew up hating football and went into fine arts while his younger sister did make a national team and that the division did eventually end after 30 years .
52900686	classification	hated	3	3	1	1	Scream hated the classification of bands into certain types and considered what they played as simply ' music .
52912520	everything	hates	2	2	5	5	Schitz embodies everything that Farid hates about the Western World .
52931110	influence	hated	5	5	3	3	Schabarum , who hated the influence of trade unions , chose to use contractors to operate the service , and Foothill executives made the service essentially strike-proof by insisting that two different companies operate the two bus yards , even if it would cost more in the short term .
52940171	brother	hating	5	5	3	3	Rool , still hating his brother , abducts Nala .
52965017	house	hates	12	12	10	10	Ryan now lives alone in the house ; the neighborhood hates the house as it drives down their property values .
52989252	music	hated	7	7	5	5	Russia relations , although Diaghilev hated his music .
53018986	milk	hates	13	13	12	12	Russell is 25 years old at the time of Yggdra Union and hates milk .
53022844	idea	hates	10	10	8	8	Ruth desperately wants to be married ; Jack hates the idea of marriage .
53023535	time	hated	3	3	1	1	Rutherford hated his time in public school however , and was later expelled from Charterhouse for what he describes as a number of instances of minor misconduct .
53028086	odor	hated	8	8	6	6	Rutten was on a horse that hated the odor of Indians so his immediate problem was how to stay in the saddle .
53031302	monarchy	hate	45	45	43	43	Rwandan expert in the trial later expounded that the latter song could not have been addressed to the Rwandan nation as a whole , because the Tutsis were associated with the Rwandan monarchy and colonial regime , and that it was impossible to hate the monarchy without hating the Tutsis .
53045526	voice	hate	8	8	6	6	Rylan , love your personality - hate your voice .
53046741	food	hated	9	9	3	3	Ry o kan hated waste , and so any food that he was offered that he did not eat , he put into a little pot .
53059165	Edgar181	hates	11	11	10	10	Seems inappropriate , since he states on it that he hates Edgar181 .
53101858	SEED-D	hate	6	6	5	5	SEED series and I literally hate SEED-D with passion so I am only here to witness yet another fruitless debate in Wikipedia .
53104512	book	hates	18	18	14	14	See for example a blog posting by transsexual activist Julia Serano , who passionately hates Bailey ' s book but still writes -LRB- specifically about this incident involving James -RRB- , `` I am against personal attacks , particularly ones that involve someone ' s children '' and `` I do not think Bailey or his children should be personally harassed '' and `` She -LSB- James -RSB- was wrong to bring his kids into it '' .
53149553	side	hate	28	28	25	25	Sebastian said , `` There ' s a line in the song that says ' it ' s easy if they ' re faceless to hate the other side ' .
53155773	kissing	hates	12	12	11	11	Scrooge -LRB- now going by the name of Sam -RRB- still hates kissing , though .
53156100	violence	hating	6	6	3	3	Scrounging benefits whilst hating and inciting violence against the country whose hospitality he was abusing .
53170712	name	hated	3	3	1	1	Segall hated the name `` Silver Star '' and pushed to have it changed .
53174486	knight	hate	14	14	11	11	Segwardies forgives the more famous knight saying he `` will never hate a noble knight for a light lady '' , and the two team up to avoid the dangers of the isle .
53213618	polygamy	hated	3	3	2	2	Sarah always hated polygamy and rejects the idea of becoming involved in polygamy in her own romantic relationships .
53254143	kind	hates	24	24	22	22	Sasirekha -LRB- Maheswari -RRB- is the daughter of a rich father -LRB- Jayaprakash Reddy -RRB- , who is a strict disciplinarian and hates any kind of love affair .
53257772	idea	hates	3	3	1	1	Sastry hates this idea of polluting the sacredness of music by individualism and promotes another disciple ignoring Suryam .
53258719	everything	hates	2	2	1	1	Satan hates everything , Satan hates every human being .
53258719	being	hates	8	8	5	5	Satan hates everything , Satan hates every human being .
53277241	submission	hate	26	26	20	20	Saying she was accused of hating Muslims and vilifying the Qur'an and Muhammad , she clarified that she did not hate Muslims , but rather the submission of free will .
53278107	fact	hate	19	19	14	14	Saying that truth , established by world ' s highest courte , is not hate speech , but history fact .
53280234	mum	hates	9	9	7	7	Says that she adores her dad but hates her mum .
53309599	something	hates	22	22	25	25	Sara tries to deal with Jacquie ' s personality change , until Jacquie starts insisting to make Taylor a party planner , something that Sara hates .
53357206	atheism	hating	9	9	5	5	Sanderson has been accused of hating religion and confusing atheism with secularism .
53358588	second	hate	24	24	22	22	Sandford commented , `` It ' s funny because I know when I watch it that I ' ll look like I hate every second of it but I absolutely loved it .
53380969	show	hate	19	19	17	17	Sam Wollaston writing about episode one in The Guardian announces that he , `` was expecting to hate this show , '' fearing it would be `` narration interspersed with lame reconstruction , '' but he was pleased to discover it was in fact , `` a proper drama , with a very decent script and real actors .
53399939	paganism	hates	2	2	1	1	Sansum hates paganism and is particularly antagonistic towards the story of Arthur , so Derfel pretends that he is writing the Gospel in Saxon when he writes down the story of Arthur for Igraine .
53414465	everything	hated	8	8	6	6	San Francisco Chronicle writer Mick LaSalle hated almost everything screened at the festival , with the exception of Bill Plympton ' s One of Those Days .
53425838	memory	hates	3	3	1	1	Samar hates the memory of Gauri , whom he believes to be his mother ' s killer .
53429729	treatment	hated	6	6	2	2	Sam Coslow hated Jones ' irreverent treatment .
53477360	music	hated	6	6	4	4	Saint-Sa e ns also hated the music of Claude Debussy ; he is reported to have told Pierre Lalo , music critic , and son of composer E douard Lalo , `` I have stayed in Paris to speak ill of Pell e as et M e lisande .
53482048	something	hating	4	4	3	3	Sadly people are hating something they should like , being honest .
53508152	trade	hated	7	7	4	4	Sailors knew about and hated the slave trade , so , at port towns , recruiters and tavern owners would get sailors very drunk -LRB- and indebted -RRB- , and then offer to relieve their debt if they signed contracts with slave ships .
53528460	music	hates	2	2	1	1	Sachi hates music , as he believes that his father has not made any money out of it .
53539389	V	hate	12	12	10	10	Sadistic , cowardly and arrogant , he quickly came to hate the V .
53553610	work	hates	10	10	8	8	Saito does not try to hide that he hates grunt work , but does so as he is a part of Section 9 .
53580414	interference	hated	11	11	7	7	R o zsa , who also reportedly hated the interruptions and interference by producer David O Selznick , never worked for either Hitchcock or Selznick again .
53587839	city	hates	3	3	1	1	Rules hates the city and lives on a `` ranch '' sixty miles from it , `` east of Chino '' .
53592053	star	Hates	7	7	5	5	Rumors circulated that former Everybody Hates Chris star , Tequan Richmond had been cast in the role ; the speculation was later confirmed by ABC Soaps In Depth .
53604847	life	hates	6	6	4	4	Rose is at first hates town life and feels out of place .
53614220	idea	hates	20	20	18	18	Rolling Stone writes `` Kiss ' s greatest-hits collections have all been conspicuously incomplete , as if it hates the idea of anyone buying just one Kiss album , but Double Platinum is the most solid , though not as much fun as Alive !
53629821	man	hates	14	14	8	8	Running Wolf makes it very clear that he hates white people and the rich man refuses to accept him .
53638222	fact	hate	22	22	20	20	Ross Kemp , who played the lead character of Staff Sergeant Henno Garvie in the show , said `` I hate the fact that most of the original cast were killed off the show , people I ' d worked with for years making this , but we must move on .
53674638	blackness	hate	21	21	19	19	Ruckus became an evangelist after dreaming of going to `` White Heaven , '' preaching that black people must hate their blackness and love the white man to receive entrance into heaven -LRB- `` The Passion of Reverend Ruckus '' -RRB- .
53674710	blackness	hating	46	46	43	43	Ruckus was diagnosed with a tumor on his back and doctors say that soon he will die , but in his remaining days he wants to spread the word about how black people can redeem themselves and gain admittance to White Heaven through hating their own blackness .
53681091	Love	hates	19	19	15	15	Rudra -LRB- Girish Karnad -RRB- , a very strict disciplinarian father of two daughters , hates the word ' Love ' .
53695770	guitar	hate	22	22	20	20	Rob said -LSB- derisively -RSB- , ' It sounds like the ' 70s ' and Graham said , ' I hate acoustic guitar , ' so I knew we were onto a winner .
53699430	wife	hating	49	49	43	43	Rocco brings in Strike for questioning , again , as well as Victor and his mother , who , already facing an inevitable life sentence , finally reveals that it was him who had committed the murder , in a moment where , hating his difficult life and ungrateful wife , impulsively decided to murder Darryl as Strike had suggested with a gun he had earlier found and kept .
53706768	music	hated	20	20	18	18	Rock critic Robert Christgau wrote that despite their being avowed feminists , which he sympathized with , he hated their music as `` Squeaky-clean folk rock '' .
53718790	spending	hates	12	12	9	9	Ron -LRB- Nick Offerman -RRB- is delighted because he hates any government spending , which leads him to heated arguments with Leslie .
53725493	film	hating	43	43	41	41	Robert Mazzocco in The New York Review of Books , Greil Marcus in The Village Voice and John Malone in The New York Times wrote articles that ranged from debunking the hype and calling Nashville superficial and overrated , to absolutely hating the film for its aesthetic shortcomings or its purported pessimism , cynicism and sexism .
53791120	war	hate	7	7	6	6	Roosevelt ' s historic `` I hate war '' speech was delivered from the podium in the Chautauqua Amphitheater -LRB- 1936 -RRB- .
53844518	homosexuality	hates	12	12	11	11	Sherry interviews that she believes the Bible tells her the God hates homosexuality and that homosexuals wo not `` inherit the kingdom .
53844986	father	hates	15	15	13	13	She rubs a few abrasions on her arm , and tells him she hates her father .
53847571	type	hate	10	10	8	8	She ' s a definite love her or hate her type of character , one who ' ll prove the bane to many a series regular , and probably some viewers as well .
53850752	film	hate	19	19	18	18	She said to Laurence Olivier on a long-distance call , `` Puss , my puss , how I hate film acting !
53857314	killing	hates	19	19	18	18	She sets off to kill the members of Ruka so that Izaya may remain safe even though she hates killing .
53860892	sin	hate	32	32	30	30	She silently accepted Phil ' s wife ' s comments that Vito was ultimately a sinner and probably killed after picking up a stranger , but that they should `` hate the sin , not the sinner '' .
53872530	song	hated	4	4	2	2	She reportedly hated the song claiming it was recorded `` in three hours with the worst four musicians in Paris .
53880713	brutality	hates	3	3	2	2	She really hates brutality and will immediately attack an offender by throwing knives , among her many other weapons .
53880715	Pinky	hates	3	3	2	2	She really hates Pinky because Pinky has a crush on Pac-Man .
53880716	samurai	hates	3	3	2	2	She really hates samurai because she lost her parents in a great battle against the Fujimori clan .
53880954	stepdaughter	hated	35	35	32	32	She reasons that if she allows her stepdaughter to be killed in front of her the very first time the two met , then `` people will say that your Japanese stepmother hated her Chinese stepdaughter so much - though they were separated by three thousand leagues - that she had her put to death before her eyes .
53888920	style	hated	21	21	16	16	She redecorated The Glen , Scottish home of Christopher Tennant , 2nd Baron Glenconner , who hated the existing Scottish Baronial style of the house .
53895152	school	hated	4	4	3	3	She says she hated school and would spend her free time at home reading fairy tales and mythology .
53895153	body	hates	5	5	3	3	She says she hates her body and hates that men keep looking at her .
53895155	idea	hates	5	5	3	3	She says she hates the idea of prom , but secretly wants to attend .
53895819	experience	hated	6	6	4	4	She says that she hated the experience of being at drama school and lost her confidence .
53896245	line	hates	8	8	6	6	She says this is because she hates the line , `` Life is but a dream '' .
53898209	power	hate	5	5	2	2	She seemed hate her own power .
53898943	everyone	hate	4	4	3	3	She seems to hate everyone , especially the poor .
53898944	sister	hate	5	5	3	3	She seems to hate her sister , though for unknown reasons .
53898946	sire	hate	7	7	3	3	She seems to hate Seth ' s sire while at the same time lusting after Seth .
53898947	principal	hate	5	5	3	3	She seems to hate the principal .
53902817	anything	hated	22	22	21	21	She offers Tom some fascinating insights into Danny ' s behaviour , labelling him `` a bottomless pit '' who `` hated anything he could not control .
53904733	idea	hated	15	15	13	13	She once confided that she never wanted to get married , as she hated the idea of being `` tied to the kitchen sink '' .
53904959	Accounting	hated	6	6	5	5	She once said `` I hated Accounting , I wanted to become a scientist like Albert Einstein '' .
53905115	club	hates	5	5	2	2	She one-sidedly hates the movie club , especially its president , Maria .
53905998	job	hates	9	9	7	7	She openly despises the students and clearly hates her job , giving horrible advice to Jerri after her father died .
53907830	toast	hated	3	3	2	2	She originally hated toast but later grew to like it .
53917131	everyone	hates	4	4	3	3	She pretty much hates everyone , and for good reason .
53925567	life	hated	8	8	7	7	She ran off to Canada because she hated life in Japan .
53929153	race	hates	22	22	19	19	She pitches him `` Hardly Working '' , about a man called John Hardly who loves his family and hates the rat race , but he rejects it and tells her that she needs to make another episode of TGS .
53941232	idea	hates	10	10	8	8	She ' s very protective of Trunks and hates the idea of him fighting , but nevertheless allows him to take the time machine to the past to stop the Androids and also deliver Goku an antidote for a heart virus that claimed his life in the alternate timeline .
53945930	sister	hates	18	18	16	16	She tells Frank Farmer , the bodyguard -LRB- Kevin Costner -RRB- she did it because she hates her sister and is jealous of her .
53946367	fact	hates	8	8	6	6	She tells him how much she hates the fact that she will never have children or grow old and die , and believes that Kell understands her pain .
53946975	silence	hates	7	7	5	5	She tells him that she hates his silence , and they fight , Todd convinced that the Mayor has changed and Viola accusing him of turning into the Mayor .
53947991	family	hates	7	7	5	5	She tells Schwartz that she hates her family because many tried her like a prize because her child , whoever the father is , would become the Rose Dominion Princess , be it a male or female .
53951397	father	hate	8	8	6	6	She stated that initially she did hate her father .
53951538	squid	hates	6	6	4	4	She stated that she hates dried squid .
53979416	father	hated	13	13	11	11	She told him that the king was her father , and hated his father , which was why he had made the prince lose .
53980178	nature	hates	8	8	4	4	She , too , hates Charles ' domineering nature .
54001943	stepdaughter	hating	12	12	7	7	She turned her anger upon Hongryeon , hating and abusing this remaining stepdaughter more than ever .
54010725	twin	hate	25	25	23	23	She wants to be with Sean but when he refuses her she tricks Garrick into thinking Sean raped her , causing Garrick to hate his twin .
54011201	Ka-Lok	hates	2	2	6	6	She warned Ka-Lok that Big Ding hates liars and event worst , infidelity -LRB- due to his father cheating on his mother and having an illegitimate son -RRB- ; keeping it a secret is the only way to have a happy life with Big Ding .
54013526	war	hates	14	14	13	13	She speaks very bluntly , refers to herself using masculine pronouns , and hates war .
54021072	day	hating	5	5	2	2	She started hating the first day of school when she started fourth grade , when her former best friend Megan replaced her with three popular girls named Becca , Ashley , and Jen .
54024465	kinky	hating	15	15	13	13	She starts saving money to travel to Jamaica with her grandmother while simultaneously hating her kinky African hair and her Jamaican curves .
54055612	romance	hates	8	8	7	7	She is the only squirrel scout who hates romance .
54060411	reserve	hate	5	5	11	11	She is trapped at the reserve which she has come to hate .
54061010	life	hates	16	16	13	13	She is unhappy and sends a letter to Jack telling how much she hates her new life .
54062681	attention	hates	11	11	8	8	She is very protective of Peter , and hates his paying attention to any other female .
54062732	idea	hates	14	14	12	12	She is very quiet as her parents are undergoing divorce and she hates the idea of thinking that her parents do not want her .
54101132	boy	hates	28	28	35	35	She calls Charlie , Charlotte -LRB- even though that Charlie explained that everybody calls her Charlie -RRB- and she also forces Charlie to sit next to an intelligent boy , James Edwards , whom Charlie hates .
54101975	life	hated	13	13	10	10	She came from a rich family , but she really hated the posh life , and so she left home and became a Greaser .
54102280	fact	hated	20	20	18	18	She came on the ship to leave Kettlecorn , where she lived on a farm , because she hated the fact that the town is so small .
54145874	literature	hate	32	32	31	31	She forbade publishing of her works in any anthologies or school books , based on her belief that her black and death-like poetry would be a big reason that young people hate literature .
54146985	Charity	hated	23	23	20	20	She found an unwitting ally in Kay Bennett , a young next-door neighbor who coveted Miguel for herself and therefore hated her cousin Charity .
54154265	name	hated	6	6	3	3	She had always hated her birth name , and later legally changed her name to Butterfly McQueen .
54160303	husband	hate	7	7	4	4	She had grown to hate her domineering husband , and had already attempted to kill him as well .
54167981	cream	hates	8	8	6	6	She enjoys reading babysitting books and hates ice cream .
54168126	thinking	hates	6	6	4	4	She enjoys violence but hates excessive thinking .
54187005	mother	hates	22	22	14	14	She eventually confronts Henet , who in a fit of pique , admits she hates Renisenb and hated Renisenb ' s long-deceased mother .
54189774	truck	hate	25	25	23	23	She explained , `` I had this song called ' Picture to Burn , ' that ' s talking about how ' I hate your truck , ' and ' I hate that you ignored me , ' ' I hate you .
54190208	everyone	hates	6	6	5	5	She explains how he usually hates everyone but liked Jerry , as he reminded him of a certain `` somebody '' from Korea ; she then mentions that he thinks George is gay because `` he pretty much thinks everyone is gay .
54194053	man	hate	25	25	23	23	She felt hatred and resentment taking complete possession of her , and she cried out , `` Oh God do not let me hate that man .
54206516	son	hate	6	6	4	4	She gradually started to hate her son for his emotionless behaviour and began to neglect and ignore him .
54221374	father	hate	9	9	6	6	She discovered that she could not hate her biological father for being an absentee , a slacker , and even a supervillain thug , and also learns from the tragedy to accept Pat Dugan as the first true father figure in her life .
54224328	Sudha	hates	7	7	6	6	She does not love Govind and hates Sudha with a passion .
54224457	person	hates	11	11	14	14	She does not realize that one she admirers is the same person whom she hates .
54231419	thunder	hates	20	20	19	19	She has some weak points as she is a poor cook , is not good with mechanical appliances and hates thunder .
54251766	food	hated	4	4	1	1	She hated all the food they made , except Real ' s salad .
54251769	competition	hated	2	2	1	1	She hated competition and disliked to be substituted by her rival Lovisa Augusti , who was her replacement whenever she was sick or bore children - she had six children - and in 1784 she chose to resign .
54251772	background	hated	4	4	1	1	She hated her Jewish background and was convinced it had poisoned her life .
54251774	son-in-law	hated	3	3	1	1	She hated her son-in-law , Caco , but was as resentful as he when it came to her present financial situation , being capable of reproachable actions if it meant that she could make some money out of it .
54251779	housework	hated	2	2	1	1	She hated housework but enjoyed cooking .
54251781	Jezmine	hated	2	2	1	1	She hated Jezmine -LRB- possibly stemming at least partly from jealousy of her close friendship with Conan and viewing her as a rival for his affections -RRB- and Jezmine despised her right back .
54251784	poverty	hated	2	2	1	1	She hated poverty , but she hated affluence , too .
54251784	affluence	hated	7	7	6	6	She hated poverty , but she hated affluence , too .
54251787	school	hated	2	2	1	1	She hated school and , typical of a Swedish working-class girl at that time , she did not attend high school .
54251788	attention	hated	3	3	1	1	She hated the attention her size brought her , and her spine developed a severe curvature .
54251789	man	hated	4	4	1	1	She hated the convicted man for ruining her father .
54251790	fishbowl	hated	3	3	1	1	She hated the fishbowl of politics .
54251791	job	hated	3	3	1	1	She hated the job and frequently cried herself to sleep .
54251792	leader	hated	4	4	1	1	She hated the Plume leader , Worron , for being a tyrant and a coward and so she took his place as Piper after gaining the trust of the Plumes .
54251793	dogmatism	hated	9	9	1	1	She hated the school ' s repressiveness and the dogmatism of its religious teaching and took to writing poetry .
54251794	tradition	hated	3	3	1	1	She hated the tradition of younger players competing only against each other on the junior circuit .
54251798	family	hated	5	5	1	1	She hated Travis and his family for being stuck with his father who sexually molested her -LRB- revealed in a fast-forwarded cutscene , when slowed down -RRB- after causing her mother to commit suicide .
54251809	everything	hates	3	3	1	1	She hates almost everything about the real world , except crimes , reality shows , and driving her motorcycle .
54251811	cleanliness	hates	4	4	1	1	She hates and fears cleanliness as much as Ammonia hates dirt which proves to be a problem when the two are required to team up .
54251811	dirt	hates	10	10	9	9	She hates and fears cleanliness as much as Ammonia hates dirt which proves to be a problem when the two are required to team up .
54251826	bullying	hates	2	2	1	1	She hates bullying of all kinds , but this does not stop her from bullying others .
54251838	everything	hates	2	2	1	1	She hates everything about India - noise , poverty , smells - stays inside always , and wants to return to England .
54251839	everything	hates	3	3	1	1	She hates `` everything in the world .
54251840	Evinlea	hates	2	2	1	1	She hates Evinlea with good reason and she does not have nearly the power of Evinlea .
54251841	exposure	hates	4	4	1	1	She hates excessive light exposure and also does poorly in hot weather , though the latter is because she grew up in northern Japan .
54251842	feeling	hates	2	2	1	1	She hates feeling weak or helpless .
54251844	fish	hates	2	2	1	1	She hates fish , and believes she may have ichthyophobia .
54251852	Fist	hates	8	8	1	1	She hates Grotessa , Grotus , and Computer Fist .
54251855	daughter-in-law	hates	3	3	1	1	She hates her daughter-in-law for being short and dreams of getting rid of her so that her son can finally marry a tall woman .
